Local,Nombre,Precio,Cantidad
PlazaVea,Repuesto de Máquina de Afeitar SCHICK Paquete 6un,36.90,Botella 1L
PlazaVea,Gel de Baño Avena BABARIA Frasco 600ml,19.10,Botella 1L
PlazaVea,Tinte IGORA Oxigenta con fragancia 30 Frasco 50Ml,3.80,Botella 1L
PlazaVea,Desodorante en Roll On para Hombre REXONA Sport Intense Odor Control Frasco 50ml,13.50,Botella 1L
PlazaVea,Desodorante en Roll On para Mujer REXONA Sport Intense Odor Control Frasco 50ml,13.50,Botella 1L
PlazaVea,Jabón de Tocador JOHNSON'S Iluminadora Paquete 3un,9.20,Botella 1L
PlazaVea,Cepillo de Dientes ORAL B Crayons Paquete 5un,14.88,Botella 1L
PlazaVea,Desodorante en Barra para Hombre REXONA Sport Intense Odor Control Frasco 50g,13.90,Botella 1L
PlazaVea,Desodorante en Aerosol para Mujer LADY SPEED STICK Clinical Complete Protection Frasco 93g,14.90,Botella 1L
PlazaVea,Jabón Líquido BALANZÉ Dermo Frasco 500ml,6.79,Botella 1L
PlazaVea,Crema Facial POND'S Clarant B3 Frasco 200g,29.90,Botella 1L
PlazaVea,Colonia para Mujer DROWA Frasco 1L + Frasco 60ml,32.50,Botella 1L
PlazaVea,Pasta Dental SENSODYNE Blanqueador Extra Fresh - Tubo 90g,17,Botella 1L
PlazaVea,Cepillo de Dientes COLGATE Slim Soft Advance Paquete 2un,23.30,Botella 1L
PlazaVea,Crema Depilatoria DEPILÉ Bajo Ducha Tubo 200ml,34.90,Botella 1L
PlazaVea,Acondicionador HEAD & SHOULDERS Manzana Fresh Tubo 300ml,16.50,Botella 1L
PlazaVea,Acondicionador HEAD & SHOULDERS Carbón Activado Tubo 300ml,16.50,Caja 300ml
PlazaVea,Tinte para Cabello SOFT COLOR Sin Amoníaco 30 Castaño Oscuro Caja 1un,26.90,Caja 300ml
PlazaVea,Pañitos Intimos NOSOTRAS Diarios Sensitive Paquete 16un,7.60,Caja 300ml
PlazaVea,Protector Diario NOSOTRAS Largos con Alas Paquete 72un,21.90,Caja 300ml
PlazaVea,Jabón BIOCLEAN Mascarilla Exfoliante Arcilla Caja 120g,10.90,Caja 300ml
PlazaVea,Jabón Íntimo NOSOTRAS Herbal Frasco 200ml,22.90,Caja 300ml
PlazaVea,Shampoo SAVITAL Sábila y Biotina Frasco 530ml,10.50,Caja 300ml
PlazaVea,Jabón Íntimo Herbal NOSOTRAS Frasco 200ml + Pañitos,19.50,Caja 300ml
PlazaVea,Jabón BIOCLEAN Mascarilla Exfoliante Carbon Activado Caja 120g,10.90,Caja 300ml
PlazaVea,Tinte para Cabello GARNIER Nutrisse Coloríssimos 6646 Cobrizo Rubí Caja 1un,18.90,Caja 300ml
PlazaVea,Tinte para Cabello GARNIER Nutrisse Coloríssimos 462 Cieruela Caja 1un,18.90,Caja 300ml
PlazaVea,Acondicionador KATIVA Coconut Frasco 500ml,30.90,Caja 300ml
PlazaVea,Shampoo KATIVA Coconut Frasco 500ml,30.90,Caja 300ml
PlazaVea,Pasta Dental SENSOFLUOR Triple Acción Tubo 75g Paquete 2un,5.50,Caja 300ml
PlazaVea,Crema Facial Ácido Hialurónico L'OREÁL Noche Frasco 50ml,78.90,Caja 300ml
PlazaVea,Shampoo ELVIVE Color Vive Frasco 680ml,27.90,Caja 300ml
PlazaVea,Acondicionador ELVIVE Nutrición Intensa Óleo de Coco Frasco 680ml,27.90,Caja 300ml
PlazaVea,Shampoo ELVIVE Nutrición Intensa Óleo de Coco Frasco 680ml,27.90,Caja 300ml
PlazaVea,Shampoo ELVIVE RT5 Cica Repair Frasco 680ml,27.90,Caja 300ml
PlazaVea,Agua Micelar GARNIER Pure Active Todo en 1 Frasco 400ml,30.90,Caja 300ml
PlazaVea,Crema Facial TEATRICAL Aclaradora con Células Madre Pote 100g,11.90,Caja 300ml
PlazaVea,Jabón Líquido BOREAL Eucalípto Fasco 500ml,6.79,Caja 300ml
PlazaVea,Jabón Líquido BOREAL Flor de Vainilla Frasco 500ml,6.79,Caja 300ml
PlazaVea,Preservativo PRUDENCE Sabores y Colores Mix Caja 3un,6.20,Caja 300ml
PlazaVea,Enjuague Bucal COLGATE Plax Ice Fusion Frasco 500ml,17.20,Caja 300ml
PlazaVea,Acondicionador TONNO Efecto Brasilero Frasco 400ml,22.90,Caja 300ml
PlazaVea,Shampoo TONNO Efecto Brasilero Frasco 400ml,22.90,Caja 300ml
PlazaVea,Desodorante en Roll On para Hombre LEA Dermo Protection Frasco 50ml,8.30,Caja 300ml
PlazaVea,Desodorante en Roll On para Hombre LEA Extra Dry Frasco 50ml,8.30,Caja 300ml
PlazaVea,Shampoo KATIVA Colágeno Frasco 500ml,30.90,Caja 300ml
PlazaVea,Shampoo THE BARBERIA 4 en 1 Force Energy 300ml,16.90,Caja 300ml
PlazaVea,Shampoo KATIVA Colágeno Frasco 250ml,19.90,Caja 300ml
PlazaVea,Jabón de Tocador NIVEA Proteína Leche Barra 90g Paquete 6un,17.90,Caja 300ml
PlazaVea,Loción Capilar BIOCRES Acción Anticaída Frasco 200ml,69.90,Caja 300ml
PlazaVea,Gel EGO Extreme Max Frasco 100g,4.50,Caja 300ml
PlazaVea,Practipañal para Mujer PLENITUD Femme Incontinencia Leve a Moderada Paquete 10un,7.50,Caja 300ml
PlazaVea,Gel EGO Black Cool Frasco 505g,15.90,Caja 300ml
PlazaVea,Gel de Afeitar THE BARBERIA Aloe Vera y Cúrcuma Tubo 150ml,18.90,Caja 300ml
PlazaVea,Máquina de Afeitar PERSONa Mystique Paquete 2un,9.50,Caja 300ml
PlazaVea,Desodorante Aerosol para Pies DEO PIES Clinical Frasco 260ml,26.20,Caja 300ml
PlazaVea,Desodorante en Roll On para Hombre OLD SPICE Leña Frasco 50ml,12.50,Caja 300ml
PlazaVea,Desodorante en Aerosol para Mujer NIVEA Deo Invisible Black & White Frasco 150ml,15.50,Caja 300ml
PlazaVea,Máquina de Afeitar SCHICK Quattro Titanium Piel Normal Paquete 3un + Paquete 3un,28.50,Caja 300ml
PlazaVea,Complemento Nutricional ENSURE Advance Chocolate Lata 850g,105.90,Caja 300ml
PlazaVea,Fortificante en Polvo NUNATURA Andean Superdrink Chocolate Doypack 200g,11.50,Caja 300ml
PlazaVea,Exfoliante NEUTROGENA Purified Skin Frasco 100g,34.50,Caja 300ml
PlazaVea,Crema de Peinar ELVIVE Óleo Coco Cabello Muy Seco Frasco 300ml,14.90,Caja 300ml
PlazaVea,Pasta Dental COLGATE Clean Mint Tubo 75ml,11.30,Caja 300ml
PlazaVea,Crema de Tratamiento FRUCTIS Hair Food Nutritiva de Palta Frasco 350ml,20.40,Caja 300ml
PlazaVea,Crema de Tratamiento FRUCTIS Hair Food Reparadora de Coco Frasco 350ml,20.40,Caja 300ml
PlazaVea,Crema de Peinar ELVIVE Dream Long Frasco 300ml,14.90,Frasco 300ml
PlazaVea,Pañales PRUDENTIAL Total Talla G Paquete 20un,68,Frasco 300ml
PlazaVea,Crema de Peinar RECAMIER Muss Proteína de Seda y Manzanilla Frasco 300ml,14.90,Frasco 300ml
PlazaVea,Crema de Tratamiento NUTRIBELA Termoprotección Frasco 300g,12.90,Frasco 300ml
PlazaVea,Crema Depilatoria VEET Piel Sensible 50ml Paquete 1un,15.80,Frasco 300ml
PlazaVea,Tinte para Cabello EXCELLENCE Extra Profundo 300 Castaño Oscuro Caja 1un,29.90,Frasco 300ml
PlazaVea,Toallas Húmedas para Adultos TENA Clásicas Paquete 20un,5.60,Frasco 300ml
PlazaVea,Acondicionador REVLON Colorsilk Tonos Castaños Frasco 250ml,18.90,Frasco 300ml
PlazaVea,Crema para Peinar SAVITAL Colágeno y Sábila Frasco 275ml,9.90,Frasco 300ml
PlazaVea,Shampoo VITANE Advance Men Pure Balance Uso Diario Frasco 400ml,10.50,Frasco 300ml
PlazaVea,Acondicionador TRESEMMÉ Detox Capilar Frasco 400ml,15.90,Frasco 300ml
PlazaVea,Hisopos BOREAL Clásicos Empaque 100un,5.89,Frasco 300ml
PlazaVea,Desmaquillantes TIPPYS Classic 80un Paquete 3un,23.30,Frasco 300ml
PlazaVea,Bandas Depilatorias Faciales DEPILÉ Manzanilla Paquete 6un,13.69,Frasco 300ml
PlazaVea,Pañitos Húmedos NOSOTRAS Frescura Extrema Paquete 16un,7.60,Frasco 300ml
PlazaVea,Toalla Higiénica LADYSOFT Delgada con Alas Paquete 42un,13.20,Frasco 300ml
PlazaVea,Gel MOCO DE GORILA Punk Frasco 85g,8.50,Frasco 300ml
PlazaVea,Crema para Piernas INSTITUTO ESPAÑOL Arnica Frasco 500ml,32.99,Frasco 300ml
PlazaVea,Crema Corporal NIVEA Soft Milk Piel Seca Frasco 125ml,13.90,Frasco 300ml
PlazaVea,Water Gel NEUTROGENA Hydro Boost FPS 25 Frasco 55g,44.90,Frasco 300ml
PlazaVea,Papel Facial BOREAL Caja 3un,6.90,Frasco 300ml
PlazaVea,Tinte para Cabello EXCELLENCE Creme 5 Castaño Claro Caja 1un,29.90,Frasco 300ml
PlazaVea,Acondicionador DOVE Súper 1 Minuto Concentrado Reconstructor Tubo 170ml,16.90,Frasco 300ml
PlazaVea,Cepillo Dental SENSODYNE Limpieza Profunda - Paquete 1 un,14.10,Frasco 300ml
PlazaVea,Acondicionador PANTENE Micellar Frasco 400ml,17.40,Frasco 300ml
PlazaVea,Shampoo HERBAL ESSENCES Rosmery Frasco 400ml,31.90,Frasco 300ml
PlazaVea,Acondicionador HERBAL ESSENCES Argan Oil of Morocco Frasco 400ml,31.90,Frasco 300ml
PlazaVea,Tinte para Cabello PALETTE Perfect Gloss Color 700 Rubio Miel Caja 1un,13.90,Frasco 300ml
PlazaVea,Tinte para Cabello PALETTE Perfect Gloss Color 600 Rubio Sensación Caja 1un,13.90,Frasco 300ml
PlazaVea,Colonia SPIDERMAN Frasco 220ml,17.90,Frasco 300ml
PlazaVea,Tinte para Cabello PALETTE Perfect Gloss Color 200 Negro Espresso Caja 1un,13.90,Frasco 300ml
PlazaVea,Desodorante en Aerosol para Hombre NIVEA Ice 48H Spray 150ml,15.50,Frasco 300ml
PlazaVea,Crema para Ojos NEUTROGENA Hydro Boost Water Gel Caja 15g,39.90,Frasco 300ml
PlazaVea,Toalla Higiénica NOSOTRAS Invisible con Desodorante Paquete 10un,8.10,Frasco 300ml
PlazaVea,Crema para Piernas GOICOECHEA Árnica y Manzanilla Frasco 400ml,32.90,Frasco 300ml
PlazaVea,Acondicionador DOVE Nutrición Óleo-Micelar Frasco 400ml,16.90,Frasco 300ml
PlazaVea,Enjuague Bucal COLGATE Plax Ice Glacial Frasco 700ml,25.90,Frasco 300ml
PlazaVea,Retocador de Canas MAGIC RETOUCH Castaño Claro Frasco 1un,33.20,Frasco 300ml
PlazaVea,Retocador de Canas MAGIC RETOUCH Castaño Frasco 1un,33.20,Frasco 300ml
PlazaVea,Gel de Cabello MOCO DE GORILA Sport Pote 270g,15.90,Frasco 300ml
PlazaVea,Crema de Manos LEA Nutri Karité Pote 125ml,17.50,Frasco 300ml
PlazaVea,Acondicionador SEDAL Keratina Frasco 650ml,21.90,Frasco 300ml
PlazaVea,Complemento Nutricional PVM Chocolate Pote 1000g,64.50,Frasco 300ml
PlazaVea,Crema Corporal NIVEA Body Rosa & Oil de Argan Frasco 400ml,28.90,Frasco 300ml
PlazaVea,Protectores Diarios KOTEX Normal Multiajustable Paquete 180un,23.90,Frasco 300ml
PlazaVea,Acondicionador PANTENE Fuerza y Reconstrucción Frasco 400ml,17.40,Frasco 300ml
PlazaVea,Shampoo Anticaspa BALANZÉ BÁSICOS Frasco 750ml,7.30,Frasco 300ml
PlazaVea,Enjuague Bucal LISTERINE Anticaries Zero Frasco 180ml,10.50,Frasco 300ml
PlazaVea,Jabón Líquido PALMOLIVE Sensación Renovadora Doypack 500ml,9.50,Frasco 300ml
PlazaVea,Jabón Íntimo PROTEX Delicate Care Frasco 200ml,19.70,Frasco 300ml
PlazaVea,Pasta Dental COLGATE Triple Acción Tubo 100ml Paquete 3un,13.90,Paquete 300ml
PlazaVea,Toalla Higiénica NOSOTRAS Buenas Noches Mayor Protección Paquete 24un,15.30,Paquete 300ml
PlazaVea,Jabón Antibacterial PROTEX Avena Barra 110g Paquete 3un,8.50,Paquete 300ml
PlazaVea,Pasta Dental DENTO Triple Acción 6Pack Tubo 80g,14.90,Paquete 300ml
PlazaVea,Pasta Dental AQUAFRESH Triple Protección - Paquete 3 un x Tubo 100ml,14.20,Paquete 300ml
PlazaVea,Pasta Dental DENTO Herbal Tubo 90g Paquete 6un,10.50,Paquete 300ml
PlazaVea,Toallas Higiénicas NOSOTRAS Alas Tela Gel Paquete 36un,11.20,Paquete 300ml
PlazaVea,Pasta Dental COLGATE Total 12 Clean Mint Tubo 75ml Paquete 3un,20.90,Paquete 300ml
PlazaVea,Toalla Higiénica LADYSOFT Normal Paquete 60un,13.90,Paquete 300ml
PlazaVea,Pasta Dental Colgate Luminous White 2x75ml,18.80,Paquete 300ml
PlazaVea,Espuma de Afeitar NIVEA Men Protect & Care Frasco 200ml,31.90,Frasco 200ml
PlazaVea,Enjuague Bucal LISTERINE Menta Fría Frasco 1L,29.90,Frasco 200ml
PlazaVea,Máquina de Afeitar SCHICK Quattro Titanium 4 Precisión Paquete 1un,34.90,Frasco 200ml
PlazaVea,Pasta Dental COLGATE Total 12 Clean Mint Tubo 150ml,18.30,Frasco 200ml
PlazaVea,Limpiadora NIVEA Gel Purificadoor Tubo 150ml,33.90,Frasco 200ml
PlazaVea,Enjuague Bucal ORAL B Menta Refrescante Botella 500ml,16,Frasco 200ml
PlazaVea,Crema Corporal NIVEA Piel Extra Seca Frasco 250ml,24.90,Frasco 200ml
PlazaVea,Crema Corporal PORTUGAL Leche Almendras Frasco 250ml,11.59,Frasco 200ml
PlazaVea,Crema Facial POND'S Básica S Frasco 100g,21.90,Frasco 200ml
PlazaVea,Crema Facial POND'S Clarant B3 Piel Grasa Frasco 50g,12.90,Frasco 200ml
PlazaVea,Cuidado Facial NEUTROGENA Desmaquillante Oil Free Frasco 162ml,32.90,Frasco 200ml
PlazaVea,Tónico Facial PORTUGAL Frasco 220ml,18.80,Frasco 200ml
PlazaVea,Cepillo de Dientes AQUAFRESH Little Teeth Paquete 1un,11,Frasco 200ml
PlazaVea,Cepillo de Dientes COLGATE 360° Interdental Paquete 2un,23.30,Frasco 200ml
PlazaVea,Desmaquillante L'ORÉAL Agua Micelar Frasco 200ml,26.50,Frasco 200ml
PlazaVea,Cepillo de Dientes COLGATE Twister Paquete 3un,14.10,Frasco 200ml
PlazaVea,Cepillo dental ORAL-B Pro salud 7 beneficios suave Paquete 2Un,22.90,Frasco 200ml
PlazaVea,Máquina de Afeitar GILLETTE Mujer Venus Breeze Paquete 1un,24.90,Frasco 200ml
PlazaVea,Crema para Pies BABARIA Hidratante Frasco 150ml,24.20,Frasco 200ml
PlazaVea,Loción NIVEA Men sensitive bálsamo 0% alcohol Frasco 100ml,39.90,Frasco 200ml
PlazaVea,Jabón ASEPXIA Forte Barra 100g,10.90,Frasco 200ml
PlazaVea,Crema Corporal INSTITUTO ESPAÑOL Leche Hidratante Frasco 500ml,36.39,Frasco 200ml
PlazaVea,Cuidado facial NEUTROGENA Toallitas desmaquillantes night calming Paquete 25un,22.90,Frasco 200ml
PlazaVea,Desodorante Bucal BUK-AL Menta Envase 4ml,9.30,Frasco 200ml
PlazaVea,Repuesto para Máquina de Afeitar GILLETTE Mach 3 Turbo Caja 4un,39.90,Frasco 200ml
PlazaVea,Crema Corporal NIVEA Piel Normal Frasco 400ml,29.90,Frasco 200ml
PlazaVea,Enjuague bucal LISTERINE Menta Botella 500Ml,20.90,Frasco 200ml
PlazaVea,Crema de Manos NIVEA Aclarado Natural Frasco 75ml,21.90,Frasco 200ml
PlazaVea,Máquina para Afeitar Desechable GILLETTE Venus Suave 4 Unidades,20.90,Frasco 200ml
PlazaVea,Desodorante Body Spray en Aerosol para Hombre OLD SPICE Wolfthorn Frasco 150ml,13.50,Frasco 200ml
PlazaVea,Colonia para Mujer SPRING FLOWERS Cítrica Frasco 1L,30.90,Frasco 200ml
PlazaVea,Jabón Líquido AVAL Pétalos de Rosa Dispensador 400ml,9,Frasco 200ml
PlazaVea,Jabón Líquido Antibacterial AVAL Mágica Vainilla Doypack 800ml,12,Frasco 200ml
PlazaVea,Talco para Pies ISANA Triple Acción Frasco 140g + Spray Frasco 150ml,20.50,Frasco 200ml
PlazaVea,Gorro de Baño BOREAL Talla M Paquete 1un,4.90,Frasco 200ml
PlazaVea,Desodorante en Barra para Hombre GILLETTE Power Beads Cool Wave Frasco 82g,17.90,Frasco 200ml
PlazaVea,Gel de Ducha DAINA  Avena Frasco 750ml,24.80,Frasco 200ml
PlazaVea,Desodorante en Gel para Hombre SPEED STICK Active x5 Frasco 85g,17.90,Frasco 200ml
PlazaVea,Algodón COPPON Zigzag Bolsa 25g,2,Frasco 200ml
PlazaVea,Lima de Cartón para Uñas BOREAL Paquete 12un,4.99,Frasco 200ml
PlazaVea,Desodorante en Gel para Hombre GILLETTE Power Rush Frasco 82g,17.90,Frasco 200ml
PlazaVea,Desodorante en Barra para Mujer NIVEA Invisible Black & White Frasco 43g,15.90,Frasco 200ml
PlazaVea,Desodorante en Aerosol para Hombre NIVEA Silver Protect Frasco 150ml,15.50,Frasco 200ml
PlazaVea,Talco para Pies en HANSAPLAST Fresh Active Frasco 150ml,20.50,Frasco 200ml
PlazaVea,Esponja de Baño Anatómica PONJITA Bolsa 1un,12.90,Frasco 200ml
PlazaVea,Desodorante en Crema para Hombre ETIQUET Tubo 75g + Jabón de Tocador Barra 90g,15.50,Frasco 200ml
PlazaVea,Desodorante en Barra para Mujer SECRET Clinical Llight Fresh Frasco 45g,19.50,Frasco 200ml
PlazaVea,Jabón de Glicerina BOREAL Baby Barra 100g,2.89,Frasco 200ml
PlazaVea,Antiácido SAL DE ANDREWS Polvo efervecente triple acción Caja 12Un,10.70,Frasco 200ml
PlazaVea,Escobilla para Limpiar Uñas BOREAL Caja 1un,6.10,Frasco 200ml
PlazaVea,Desodorante en Roll On para Mujer NIVEA Invisible Black & White Frasco 50ml,15.50,Frasco 50ml
PlazaVea,Desodorante en Barra para Hombre NIVEA Silver Protect Frasco 43g,15.90,Frasco 50ml
PlazaVea,Repelente en Crema OFF Family Frasco 200g,16.20,Frasco 50ml
PlazaVea,Colonia para Mujer JEAN NATÉ Original Botella 887ml,65.50,Frasco 50ml
PlazaVea,Cortauñas de Metal BOREAL Paquete 1un,6.90,Frasco 50ml
PlazaVea,Algodón BALANZÉ Bolitas Bolsa 80g,6.60,Frasco 50ml
PlazaVea,Spray de Pies ISANA Triple Acción Frasco 150ml,17.50,Frasco 50ml
PlazaVea,Tinte para Cabello PALETTE Color Creme 5-68 Chocolate Claro Caja 1un,13.90,Frasco 50ml
PlazaVea,Aceite Tratamiento L'ORÉAL ELVIVE Óleo Extraordinario Cabello Liso Frasco 100ml,42,Frasco 50ml
PlazaVea,Ampolla PANTENE Hidrocauterización Paquete 3un,19.90,Frasco 50ml
PlazaVea,Ampolla VITANE Revitalizante Plus Paquete 4un,15.90,Frasco 50ml
PlazaVea,Tinte para Cabello PALETTE Color Creme 4-0 Castaño Medio Caja 1un,13.90,Frasco 50ml
PlazaVea,Tinte para Cabello REVLON Colorsilk 51 Castaño Claro Caja 1un,21.40,Frasco 50ml
PlazaVea,Toalla Higiénica ALWAYS Seca Noche Ultrafina Paquete 8un,6.75,Frasco 50ml
PlazaVea,Tinte para Cabello REVLON Colorsilk 20 Negro Natural Caja 1un,21.40,Frasco 50ml
PlazaVea,Tinte para Cabello CASTING Creme Gloss 700 Rubio Mediano Caja 1un,30,Frasco 50ml
PlazaVea,Mousse JOHN FRIEDA Manejable Frasco 204g,33.55,Frasco 50ml
PlazaVea,Toalla Higiénica KOTEX Ultra Fina Con Alas Paquete 10Un,4.50,Frasco 50ml
PlazaVea,Crema de Tratamiento TRESemmé Keratina Frasco 400g,17.90,Frasco 50ml
PlazaVea,Ropa interior desechable TENA Pants Ultra Incontinencia Fuerte Talla M Paquete 10un,40.50,Frasco 50ml
PlazaVea,Mascarilla de Tratamiento ELVIVE Óleo Coco Cabello Muy Seco Frasco 300ml,14.90,Frasco 50ml
PlazaVea,Crema para Peinar PANTENE Pro-V Hidrocauterización Frasco 300ml,15.90,Frasco 50ml
PlazaVea,Crema para Peinar PANTENE Restauración Frasco 300ml,15.90,Frasco 50ml
PlazaVea,Tinte para Cabello IGORA  Brilliance 668 Chocolate Imperial Caja 1un,21.90,Frasco 50ml
PlazaVea,Protectores Diarios NOSOTRAS Normal Caja 60un,13.90,Frasco 50ml
PlazaVea,Tinte para Cabello PALETTE Color Creme 7-1 Rubio Medio Cenizo Caja 1un,13.90,Frasco 50ml
PlazaVea,Tinte para Cabello SCHWARZKOPF Palette Color Creme 8-1 Rubio Claro Cenizo Caja 1un,13.90,Frasco 50ml
PlazaVea,Tinte para Cabello PALETTE Color Creme 1-0 Negro Caja 1un,13.90,Frasco 50ml
PlazaVea,Tinte para Cabello REVLON Colorsilk 60 Rubio Cenizo Oscuro Caja 1un,21.40,Frasco 50ml
PlazaVea,Tinte para Cabello REVLON Colorsilk Castaño Medio Profundo Caja 1un,21.40,Frasco 50ml
PlazaVea,Tinte para Cabello REVLON Colorsilk 50 Castaño Cenizo Caja 1un,21.40,Frasco 50ml
PlazaVea,Tampón NOSOTRAS con Aplicador Súper Caja 8un,15.60,Frasco 50ml
PlazaVea,Pañitos Húmedos NOSOTRAS Natural Paquete 16un,7.60,Frasco 50ml
PlazaVea,Toallas Húmedas para adultos TENA 3 en 1 Paquete 24un,10.40,Frasco 50ml
PlazaVea,Toallas Húmedas para Adultos TENA 3 en 1 Paquete 40un,16.30,Frasco 50ml
PlazaVea,Shampoo PANTENE Restauración Frasco 200ml,8.50,Frasco 50ml
PlazaVea,Tinte para Cabello CASTING Creme Gloss 200 Negro Caja 1un,30,Frasco 50ml
PlazaVea,Shampoo PANTENE 2 en 1 Cuidado Clásico Frasco 400ml,17.40,Frasco 50ml
PlazaVea,Complemento Nutricional PEDIASURE Chocolate Lata 900g,102.90,Frasco 50ml
PlazaVea,Desodorante en Roll On para Mujer HI & DRI Power Fresh Frasco 50ml,13.40,Frasco 50ml
PlazaVea,Oxigenta IGORA Tonos Medios Frasco 50ml,3.80,Frasco 50ml
PlazaVea,Tinte para Cabello GARNIER Nutrisse 71 Almendra Caja 1un,18.90,Frasco 50ml
PlazaVea,Tinte para Cabello GARNIER Nutrisse 60 Capuccino Caja 1un,18.90,Frasco 50ml
PlazaVea,Tinte para Cabello GARNIER Nutrisse 10 Ébano Negro Caja 1un,18.90,Frasco 50ml
PlazaVea,Máquina de Afeitar SCHICK Xtreme 3 Piel Sensible Paquete 2un,10.90,Frasco 50ml
PlazaVea,Mascarilla de Tratamiento ELVIVE RT5 Cabello Dañado Pote 350g,14.90,Frasco 50ml
PlazaVea,Tinte para Cabello GARNIER Nutrisse 70 Champaña Caja 1un,18.90,Frasco 50ml
PlazaVea,Tinte para Cabello GARNIER Nutrisse 50 Castaña Caja 1un,18.90,Frasco 50ml
PlazaVea,Tinte para Cabello GARNIER Nutrisse 30 Espresso Caja 1un,18.90,Frasco 50ml
PlazaVea,Preservativos DUREX Placer Prolongado Caja 3un,9.20,Frasco 50ml
PlazaVea,Gel de Ducha BODYCOLOGY Pink Vanilla Wish Frasco 473ml,19.90,Frasco 473ml
PlazaVea,CANTU Natural Hair Coconut Curl Frasco 340ml,69.90,Frasco 473ml
PlazaVea,Caramelos MULTIBIOTICOS Duros sin Azúcar con Sabor a Chicha Caja 5un,19,Frasco 473ml
PlazaVea,Jabón PROTEX Líquido Balance Doypack de 800ml,13.80,Frasco 473ml
PlazaVea,Desodorante Antitranspirante GILLETE Clear Gel Cool Wave Frasco 113g,21.90,Frasco 473ml
PlazaVea,Contorno de Ojos Antimanchas NIVEA Cellular Luminous Tubo 15ml,50.30,Frasco 473ml
PlazaVea,Shampoo SUMAQ Uña de Gato Frasco 500ml,29.50,Frasco 473ml
PlazaVea,Acondicionador SUMAQ Maca Frasco 500ml,29.50,Frasco 473ml
PlazaVea,Pack TIO NACHO Antiedad Jalea Real Shampoo Frasco 415ml + Acondicionador Frasco 415ml,39.90,Frasco 473ml
PlazaVea,Toallitas Higiénicas NOSOTRAS V-Confident Regular Paquete 28un,17.90,Frasco 473ml
PlazaVea,Pasta Dental BALANZÉ BÁSICOS Triple Protecciónn Tubo 90g,3.90,Frasco 473ml
PlazaVea,Kit THE BARBERIA Shampoo Anticaspa Caída Frasco 300ml + Gel de Afeitar Frasco 150ml,26.90,Frasco 473ml
PlazaVea,Shampoo HASK en Seco Charcoal Frasc 122g,35.10,Frasco 473ml
PlazaVea,Shampoo ELVIVE Dream Long Liss Frasco 370ml,14.90,Frasco 473ml
PlazaVea,Acondicionador ELVIVE Dream Long Frasco 370ml,14.90,Frasco 473ml
PlazaVea,Acondicionador ELVIVE Arcilla Frasco 370ml,14.90,Frasco 473ml
PlazaVea,Acondicionador ELVIVE Reparación Total Extrema Frasco 370ml,14.90,Frasco 473ml
PlazaVea,Jabón Líquido AROMASENSE Té Verde Doypack 800ml,13.50,Frasco 473ml
PlazaVea,Jabón Líquido AROMASENSE Frutos Rojos Frasco 580ml,14.50,Frasco 473ml
PlazaVea,Jabón Líquido AROMASENSE Avena Doypack 800ml,13.50,Frasco 473ml
PlazaVea,Cepillo Dental BALANZÉ Proactive Blíster 4un,8.90,Frasco 473ml
PlazaVea,Complemento Nutricional ENSURE Advance Fresa Banana Lata 850g,105.90,Frasco 473ml
PlazaVea,Suplemento Nutricional PEDIASURE Chocolate Lata 1.6Kg,165.10,Frasco 473ml
PlazaVea,Toallas Higiénicas NOSOTRAS Buenas Noches Talla S Paquete 3un,19.90,Frasco 473ml
PlazaVea,Máquina de Afeitar GILLETTE Ultragrip2 Paquete 3un,9.90,Frasco 473ml
PlazaVea,Protectores TENA Discreet Extralargo Paquete 50un,23.90,Frasco 473ml
PlazaVea,Desenredante para Niños GELATTI Skye Frasco 200ml,14.90,Frasco 473ml
PlazaVea,Crema Corporal NEUTROGENA Body Care Intensive Hidrata y Revitaliza Frasco 400ml,30.50,Frasco 473ml
PlazaVea,Crema Corporal NEUTROGENA Hydroboost Frasco 200ml,24.50,Frasco 473ml
PlazaVea,Pasta Dental DENTO Total Tubo 75ml Caja 3un,15.50,Frasco 473ml
PlazaVea,Shampoo TÍO NACHO Aloe Vera Frasco 1L,39.90,Frasco 473ml
PlazaVea,Máquina de Afeitar Descartable SCHICK Quattro4 Eco Friendly Caja 4un,24.90,Frasco 473ml
PlazaVea,Antitranspirante BALANZÉ Infiniti Frasco 200ml,9.60,Frasco 473ml
PlazaVea,Desodorante para Hombre BALANZÉ Choco Wild Frasco 150ml,7.70,Frasco 473ml
PlazaVea,Agua Micelar TEATRICAL Extracto de Aguacate Frasco 600ml,19.90,Frasco 473ml
PlazaVea,Crema Corporal NIVEA Naturally Good Aloe Fasco 350ml,26.30,Frasco 473ml
PlazaVea,Acondicionador PANTENE Fuerza Reconstrucción Frasco 700ml,24.90,Frasco 473ml
PlazaVea,Pasta Dental COLGATE Total 12 Encías Reforzadas Tubo 75ml Paquete 3un,24.20,Frasco 473ml
PlazaVea,Máquina de Afeitar Desechable SCHICK Xtreme3 Eco Paquete 4un,23.50,Frasco 473ml
PlazaVea,Máquina de Afeitar BALANZÉ para Mujer 4 Hojas Paquete 2un,9.90,Frasco 473ml
PlazaVea,Toallitas Antibacterianas BALANZÉ Básicos Paquete 15un,3.50,Frasco 473ml
PlazaVea,Toalla Mágica AFTERSPA Desmaquillante Mini Bolsa 1un,6.90,Frasco 473ml
PlazaVea,Crema para Cabello TIO NACHO Tratamiento Aloe Vera Botella 300ml,26.90,Frasco 473ml
PlazaVea,Crema de Tratamiento HASK 5 en 1 Argan Oil Frasco 175ml,35.10,Frasco 473ml
PlazaVea,Enjuague Bucal COLGATE Total 12 Clean Mint Frasco 500ml,16.60,Frasco 473ml
PlazaVea,Crema Definidora Curl FlexBABARIA Ondas y Rizos Frasco 250ml,21.40,Frasco 473ml
PlazaVea,Tinte para Cabello EXCELLENCE Mujer 8.17 Rubio Claro Cenizo Mate Caja 1un,29.90,Frasco 473ml
PlazaVea,Tinte para Cabello EXCELLENCE Mujer 7.17 Rubio Cenizo Mate Caja 1un,29.90,Frasco 473ml
PlazaVea,Colonia para Mujer BODYECOLOGY Sweet Love Frasco 237ml,28,Frasco 473ml
PlazaVea,Toalla Higiénica NOSOTRAS Invisible Multiestilo Paquete 10un,8.10,Frasco 473ml
PlazaVea,Aceite Corporal INSTITUTO ESPAÑOL Coco Frasco 500ml,32.99,Frasco 500ml
PlazaVea,Pañuelos Faciales ELITE Triple Hoja Aloe Vera Paquete 4un,3.50,Frasco 500ml
PlazaVea,Tinte para Cabello GREEN CODE 1.0 Negro Natural Caja 1un,22.10,Frasco 500ml
PlazaVea,Jabón Líquido Antibacterial AVAL Feria de Flores Frasco 400ml,9.50,Frasco 500ml
PlazaVea,Acondicionador HERBAL ESSENCES Passion Flower Frasco 400ml,31.90,Frasco 500ml
PlazaVea,Pañal para Adulto PLENITUD Classic Talla M Paquete 20un,53.90,Frasco 500ml
PlazaVea,Alcohol en Gel AVANT GARDE Relax Spray Frasco 180ml,14.90,Frasco 500ml
PlazaVea,Pasta Dental ORAL B Detox Sensitive Tubo 75ml,14.88,Frasco 500ml
PlazaVea,Gel de Baño INSTITUTO ESPAÑOL Coco Frasco 1.25L,32.50,Frasco 500ml
PlazaVea,Alcohol en Gel AVAL Amazon Frasco 380ml,12.50,Frasco 500ml
PlazaVea,Jabón Líquido Antibacterial BACTERION Avena y Miel Doypack 500ml,9.20,Frasco 500ml
PlazaVea,Enjuague Bucal DENTO  Xtra Mint con Alcohol Frasco 980ml,19.99,Frasco 500ml
PlazaVea,Enjuague Bucal DENTO  Zero Menta Natural Frasco 980ml,19.90,Frasco 500ml
PlazaVea,Enjuague Bucal DENTO  Zero Menta Glacial Frasco 980ml,19.90,Frasco 500ml
PlazaVea,Jabón Líquido ASEPXIA Carbón Detox Frasco 200ml,23.90,Frasco 500ml
PlazaVea,Shampoo PERT Keratina Frasco 1.2L,21,Frasco 500ml
PlazaVea,Tinte para Cabello LIFE FOR MEN 01 Negro,22.50,Frasco 500ml
PlazaVea,Tinte para Cabello PALETTE Rubio Perfecto Cenizo Caja 1un,13.90,Frasco 500ml
PlazaVea,Tinte para Cabello IGORA Vital 7-1 Rubio Mediano Cenizo Caja 1un,21.90,Frasco 500ml
PlazaVea,Tinte para Cabello IGORA Vital 3-0 Castaño Oscuro Caja 1un,21.90,Frasco 500ml
PlazaVea,Tinte para Cabello IGORA 4-0 Castaño Mediano Caja 1un,21.90,Frasco 500ml
PlazaVea,Tinte para Cabello IGORA Vital 7-00 Rubio Mediano Mate Caja 1un,21.90,Frasco 500ml
PlazaVea,Tinte para Cabello IGORA Vital 6-0 Rubio Oscuro Caja 1un,21.90,Frasco 500ml
PlazaVea,Shampoo HASK Coconut Oil Frasco 355ml,35.10,Frasco 500ml
PlazaVea,Acondicionador TONNO Rizos Definidos Frasco 400ml,22.90,Frasco 500ml
PlazaVea,Acondicionador TONNO Moroccan Argan Oil Frasco 400ml,22.90,Frasco 500ml
PlazaVea,Shampoo HASK Dry Coconut Frasco 122g,35.10,Frasco 500ml
PlazaVea,Acondicionador PETAL FRESH Uva y Aceite de Oliva Frasco 355ml,35.90,Frasco 500ml
PlazaVea,Shampoo PETAL FRESH Algas y Aceite de Argán Frasco 355ml,35.90,Frasco 500ml
PlazaVea,Crema de Peinar HERBAL ESSENCES Argán Oil Morocco Frasco 300ml,31.90,Frasco 500ml
PlazaVea,Shampoo PETAL FRESH Uva y Aceite de Oliva Frasco 355ml,35.90,Frasco 500ml
PlazaVea,Jabón de Tocador NIVEA Creme Care Barra 90g Paquete 6un,16.90,Frasco 500ml
PlazaVea,Gel de Cabello MOCO DE GORILA Sport Squizz Botella 340g,17.10,Frasco 500ml
PlazaVea,Gel Fijador ROLDA Sin Alcohol Fijación Firme Pote 250g,9.90,Frasco 500ml
