Local,Nombre,Precio,Cantidad
PlazaVea,Whisky CHIVAS REGAL Mizunara Botella 700ml,214.90,Caja 20un
PlazaVea,Cigarro PALL MALL Red XL Caja 10un,6.60,Caja 20un
PlazaVea,Cigarro MARLBORO Garden Fusion Caja 20un,15.20,Caja 20un
PlazaVea,Whisky THE GLENLIVET 12 Años Botella 700ml,148.90,Caja 20un
PlazaVea,Whisky CHIVAS REGAL 13 Años Botella 700ml,114.90,Caja 20un
PlazaVea,Vino SANTA EMA Select Terrior Reserva Carmenere Botella 750ml,44.90,Caja 20un
PlazaVea,Chicha Morada Concentrada NATURALE Sobre 250ml,4.50,Caja 20un
PlazaVea,Emoliente Concentrado NATURALE Sobre 250ml,4.50,Caja 20un
PlazaVea,Gaseosa CONCORDIA + PEPSI Botella 3L Paquete 3un,17.90,Caja 20un
PlazaVea,Gin BEEFEATER Dry Botella 1L,94.90,Caja 20un
PlazaVea,Vino WAVE Botella 750ml,19.90,Caja 20un
PlazaVea,Licor de Crema BAILEYS Salted Caramel Botella 750ml,74.90,Caja 20un
PlazaVea,Gin GREENALL'S Wild Berry Botella 700ml,59.90,Caja 20un
PlazaVea,Cerveza KAUFMANN Lager Lata 355ml Pack 12un,31.30,Caja 20un
PlazaVea,Cerveza BARBARIAN Red Ale Botella 330ml Pack 4un,27.90,Caja 20un
PlazaVea,Cerveza BARBARIAN 174 Ipa Botella 330ml Pack 4un,27.90,Caja 20un
PlazaVea,Vino Tinto VIÑA VIEJA Borgoña Lata 473ml,9.90,Caja 20un
PlazaVea,Agua Gasificada LACROIX Naranja Lata 335ml,5.90,Caja 20un
PlazaVea,Agua Gasificada LACROIX Mango Lata 335ml,3.50,Caja 20un
PlazaVea,Agua Gasificada LACROIX Limón Lata 355ml,5.90,Caja 20un
PlazaVea,Pack VAT 69 Whisky Botella 700ml + Botella 375ml,39.90,Caja 20un
PlazaVea,Vodka SKYY Citrus Botella 750ml,42.90,Caja 20un
PlazaVea,Bebida WATT'S Durazno Botella 1L,4,Caja 20un
PlazaVea,Cerveza Artesanal CANDELARIA Trigo Lata 355ml Paquete 4un,24.90,Caja 20un
PlazaVea,Cerveza STEAM BREW Imperial Ipa Lata 500ml,9.90,Caja 20un
PlazaVea,Vino Tinto HERENCIA Trabajo Blend Botella 750ml,44.70,Caja 20un
PlazaVea,Agua de Mesa LOA Sin Gas Botella 625ml,1.30,Caja 20un
PlazaVea,Vino Rosé TACAMA Ambrosía Botella 750ml,46.90,Caja 20un
PlazaVea,Whisky PASSPORT Scotch Botella 700ml,26.90,Botella 700ml
PlazaVea,Tequila ESPOLON Reposado Botella 750ml,130.19,Botella 700ml
PlazaVea,Gaseosa KR Piña Botella 400ml,1.20,Botella 700ml
PlazaVea,Bebida Rehidratante GATORADE Frutos Tropicales Botella 1L,4.20,Botella 700ml
PlazaVea,Vino NIETO SENETINER Fran Chardonnay Botella 750ml,33.50,Botella 700ml
PlazaVea,Vino NIETO SENETINER Fran Blend Botella 750ml,33.50,Botella 700ml
PlazaVea,Bebida Natural BIO Arándano con Uva y Manzana Botella 300ml,3.50,Botella 700ml
PlazaVea,Ron BACARDI Carta Blanca Botella 1.75L,69.90,Botella 700ml
PlazaVea,Whisky RED LION Blended Botella 700ml,17.30,Botella 700ml
PlazaVea,Ginger Beer FEVER TREE Botella 200ml Caja 4un,29.90,Botella 700ml
PlazaVea,Complemento para Licor GO BARMAN Botánicos Gin Tonic Pink Paquete 18g,19.90,Botella 700ml
PlazaVea,Whisky CHIVAS REGAL 15 Años Botella 750ml,164.90,Botella 700ml
PlazaVea,Bebida Rehidratante SPORADE Tropical Botella 475ml,2.20,Botella 700ml
PlazaVea,Bebida Rehidratante ELECTROLIGHT Manzana Botella 475ml,1.60,Botella 700ml
PlazaVea,Jugo de Mandarina ECOFRESH Botella 500ml,8.59,Botella 700ml
PlazaVea,Ron VIEJO DE CALDAS 8 Años Botella 750ml,64.90,Botella 700ml
PlazaVea,Ron PLANTATION Grande Reserve Botella 750ml,99.90,Botella 700ml
PlazaVea,Gin LA REPÚBLICA Ginebra Andina Artesanal Botella 700ml,79.90,Botella 700ml
PlazaVea,Bebida con Aloe Vera SAPPE Botella 1L,16,Botella 700ml
PlazaVea,Agua Mineral EVIAN Sin Gas Paquete 6un Botella 330ml,39.90,Botella 700ml
PlazaVea,Vino MISIONES DE RENGO Carmenere Botella 750ml,29.90,Botella 700ml
PlazaVea,Gin CITADELLE Botella 750ml,99.90,Botella 700ml
PlazaVea,Pisco CUATRO GALLOS Mosto Verde Italia Botella 700ml,69.90,Botella 700ml
PlazaVea,Pisco CUATRO GALLOS Mosto Verde Torontel Botella 700ml,69.90,Botella 700ml
PlazaVea,Vermouth MARTINI Rosso Botella 750ml,52.90,Botella 700ml
PlazaVea,Whisky Bourbon WILD TURKEY Botella 750ml,133.90,Botella 700ml
PlazaVea,Pack Licor APEROL Botella 750ml + Espumante CINZANO Botella 750ml,99.90,Botella 700ml
PlazaVea,Licor de Crema de Leche BURGOS Botella 750ml,44.90,Botella 700ml
PlazaVea,Vodka RUSSKAYA Cranberry Botella 750ml,22.90,Botella 700ml
PlazaVea,Pisco PAGO DE LOS FRAILES Acholado Botella 500ml,41.40,Botella 700ml
PlazaVea,Licor de Crema BAILEYS Original Irish Cream Botella 375ml,38.90,Botella 700ml
PlazaVea,Whisky OLD TIMES Blended Red Botella 750ml,20.90,Botella 700ml
PlazaVea,Gaseosa INCA KOLA sin Azúcar Botella 2.25L,7.70,Botella 700ml
PlazaVea,Néctar WATT'S Naranja Botella 350ml,2.10,Botella 700ml
PlazaVea,Vino FRONTERA Merlot Botella 750ml,27.90,Botella 700ml
PlazaVea,Vino EL COTO Tempranillo Crianza Botella 750ml,54.90,Botella 700ml
PlazaVea,Vino MONTESIERPE Rosé Semi Seco Botella 750ml,16.90,Botella 700ml
PlazaVea,Cerveza SIERRA ANDINA Pachacutec Imperial Ale Botella 330ml,10.50,Botella 700ml
PlazaVea,Cerveza SIERRA ANDINA Shaman IPA Botella 330ml,10.50,Botella 700ml
PlazaVea,Vino ESCORIHUELA GASCÓN Malbec Botella 750ml,41.90,Botella 700ml
PlazaVea,Vino CONCHA Y TORO Reservado Sauvignon Blanc Botella 750ml,22.90,Botella 700ml
PlazaVea,Vino FINCA ROTONDO Malbec Botella 750ml,30.90,Botella 700ml
PlazaVea,Vino FINCA ROTONDO Cabernet Sauvignon Botella 750ml,30.90,Botella 700ml
PlazaVea,Jugo de Uva L ONDA Botella 1L,8.70,Botella 700ml
PlazaVea,Bebida WATT'S Durazno Caja 1L,3.99,Botella 700ml
PlazaVea,Vino NAVARRO CORREAS Cabernet Sauvignon Malbec Los Árboles Botella 750ml,34.90,Botella 700ml
PlazaVea,Vino TACAMA Rosé Botella 2L,55.90,Botella 700ml
PlazaVea,Ron POMALCA Especial Black Añejo 3 Años Botella 1L,21.50,Botella 700ml
PlazaVea,Whisky GLENFIDDICH Single Malt 12 Años Botella 750ml,144.90,Botella 700ml
PlazaVea,Vodka DANZKA Grapefruit Botella 750ml,49.90,Botella 700ml
PlazaVea,Vodka DANZKA Cranraz Botella 750ml,49.90,Botella 750ml
PlazaVea,Vino TABERNERO Borgoña Botella 1.5L,31.90,Botella 750ml
PlazaVea,Ron FLOR DE CAÑA 18 Años Botella 750ml,184.90,Botella 750ml
PlazaVea,Vino EMILIANA Chardonnay Botella 750ml,32.90,Botella 750ml
PlazaVea,Vino SANTA CAROLINA Reservado Merlot Botella 750ml,19.80,Botella 750ml
PlazaVea,Vino SANTIAGO QUEIROLO Gran Tinto Shiraz Botella 750ml,21.90,Botella 750ml
PlazaVea,Vodka SKYY Clásico Botella 750ml,42.90,Botella 750ml
PlazaVea,Pisco VIEJO TONEL Gran Comodoro Acholado Botella 500ml,44.90,Botella 750ml
PlazaVea,Vino HEREDEROS DEL MARQUÉS DE RISCAL Rosado Botella 750ml,49.90,Botella 750ml
PlazaVea,Vino CATENA Malbec Botella 750ml,78.90,Botella 750ml
PlazaVea,Pisco INCA Huaco Botella 750ml,49.90,Botella 750ml
PlazaVea,Vino SANTA JULIA Fuzion Chenin Chardonnay Botella 750ml,29.90,Botella 750ml
PlazaVea,Vino CASA SILVA Reserva Limitada Cabernet Sauvignon Botella 750ml,49.90,Botella 750ml
PlazaVea,Vino FINCA LAS MORAS Sauvignon Blanc Botella 375ml,27,Botella 750ml
PlazaVea,Vino NIETO SENETINER Emilia Malbec Botella 750ml,41.90,Botella 750ml
PlazaVea,Ron CARTAVIO Black Botella 750ml,24.90,Botella 750ml
PlazaVea,Vino SANTIAGO QUEIROLO Sauvignon Blanc Gran Blanco Botella 750ml,21.90,Botella 750ml
PlazaVea,Ron MEDELLÍN 3 Años Botella 750ml,34.90,Botella 750ml
PlazaVea,Vino DON MANUEL Tannat Botella 750ml,85.50,Botella 750ml
PlazaVea,Vino MARQUÉS DE RISCAL Viña Collada Rioja Botella 750ml,39.90,Botella 750ml
PlazaVea,Vino BENJAMIN Chardonnay Botella 750ml,32.90,Botella 750ml
PlazaVea,Vino SANTA JULIA Chardonnay Botella 750ml,39.90,Botella 750ml
PlazaVea,Ron BACARDÍ Superior Botella 750ml,42.90,Botella 750ml
PlazaVea,Vino MARQUÉS DE RISCAL Reserva Botella 750ml,92.90,Botella 750ml
PlazaVea,Vino TRIVENTO Malbec Tribu Botella 750ml,31.90,Botella 750ml
PlazaVea,Vodka DANZKA Premium Original Botella 750ml,49.90,Botella 750ml
PlazaVea,Vino NIETO SENETINER Estate Cabernet Sauvignon Botella 750ml,49.90,Botella 750ml
PlazaVea,Pisco SANTIAGO QUEIROLO Italia Botella 750ml,34.90,Botella 750ml
PlazaVea,Pisco OCUCAJE Italia Botella 700ml,28.50,Botella 750ml
PlazaVea,Refresco ARUBA Citrus Punch Botella 3L,6.50,Botella 750ml
PlazaVea,Agua Mineral EVIAN sin Gas Botella con Tapa Sport 750ml,11.50,Botella 750ml
PlazaVea,Espumante TACAMA Brut Celebración Botella 750ml,36.90,Botella 750ml
PlazaVea,Espumante VALDIVIESO Brut Botella 750ml,34.90,Botella 750ml
PlazaVea,Cerveza TRES CRUCES Lata 355 ml Pack 6un,17.90,Botella 750ml
PlazaVea,Néctar SELVA Durazno Premium Botella 900ml,7.40,Botella 750ml
PlazaVea,Refresco TAMPICO Citrus Punch Botella 500ml,2.20,Botella 750ml
PlazaVea,Cigarros WINSTON Red Caja 20un,15.90,Botella 750ml
PlazaVea,Néctar SELVA Chicha Morada Premium Botella 900ml,6.90,Botella 750ml
PlazaVea,Bebida Rehidratante SPORADE Blueberry Botella 500ml,2.20,Botella 750ml
PlazaVea,Cigarros MARLBORO Blue Ice Mint Caja 20un,18.40,Botella 750ml
PlazaVea,Gaseosa CONCORDIA Piña Botella 1.5L,3,Botella 750ml
PlazaVea,Gaseosa CONCORDIA Naranja Botella 3L,6,Botella 750ml
PlazaVea,Bebida Rehidratante ELECTROLIGHT Piña Botella 475ml,1.60,Botella 750ml
PlazaVea,Espumante FREIXENET Carta Nevada Semiseco Botella 750ml,47.90,Botella 750ml
PlazaVea,Gaseosa PEPSI Botella 750ml,2.80,Botella 750ml
PlazaVea,Agua SAN CARLOS sin Gas Botella 2.25L,1.99,Botella 750ml
PlazaVea,Cerveza CUSQUEÑA Trigo Lata 269ml Paquete 6un,14.90,Botella 750ml
PlazaVea,Cerveza CUSQUEÑA Malta Lata 269ml Paquete 6un,14.90,Botella 750ml
PlazaVea,Cerveza CUSQUEÑA Dorada Lata 269ml Paquete 6un,14.90,Botella 750ml
PlazaVea,Vodka ABSOLUT RTD Pineapple - Tini Lata 355ml Paquete 4un,31.90,Botella 750ml
PlazaVea,Pack FRUGOS Néctar Durazno Caja 1.5L x 2un,8,
PlazaVea,Gaseosa COCA COLA + INCA KOLA Botella 3L Paquete 3un,29.70,
PlazaVea,Gaseosa INCA KOLA + COCA COLA Botella 3L Paquete 3un,29.70,
PlazaVea,Agua Mineral SAN MATEO Sin Gas Bidón 7L,7,
PlazaVea,Agua sin Gas CIELO Bidón 7L,6.90,
PlazaVea,Gaseosa INCA KOLA Sin Azúcar Botella 300ml Paquete 6un,7.59,
PlazaVea,Gaseosa COCA COLA Sin Azúcar Botella 300ml Paquete 6un,7.59,
PlazaVea,Gaseosa COCA COLA Sin Azúcar 2Pack Botella 1.5L,11.80,
PlazaVea,Agua SAN LUIS sin Gas Caja 20L,23.50,
PlazaVea,Gaseosa GUARANÁ Botella 3L,5.90,
PlazaVea,Ron CENTENARIO N°5 Añejo Selecto Botella 1.75L,82.90,Botella 1.75L
PlazaVea,Ron CENTENARIO N° 7 Añejo Especial Botella 750ml,72.90,Botella 1.75L
PlazaVea,Ron CENTENARIO N°5 Añejo Selecto Botella 750ml,44.90,Botella 1.75L
PlazaVea,Ron CENTENARIO N°12 Gran Legado Botella 750ml,109.90,Botella 1.75L
PlazaVea,Gin GREENALL'S Blood Orange Botella 700ml,71.90,Botella 1.75L
PlazaVea,Agua Mineral EVIAN sin Gas Botella 1.5L,15.50,Botella 1.75L
PlazaVea,Bebida Alcohólica Preparada CORONA Seltzer de Frutos Rojos Lata 355ml,5.50,Botella 1.75L
PlazaVea,Bebida Alcohólica Preparada CORONA Seltzer de Lima Limón Lata 355ml,5.50,Botella 1.75L
PlazaVea,Agua Tónica BRITVIC Botella 200ml,4.99,Botella 1.75L
PlazaVea,Agua Tónica BRITVIC Botella 200ml Paquete 4un,19.90,Botella 1.75L
PlazaVea,Cerveza RAYMI Botella 330ml Paquete 4un,28.90,Botella 1.75L
PlazaVea,Cerveza CANDELARIA Summer Lata 355ml Paquete 3un,20.70,Botella 1.75L
PlazaVea,Vodka MIKE'S Hard Passion Fruit Lata 355ml,5.50,Botella 1.75L
PlazaVea,Vodka DR. LEMON Limón Lata 473ml,7.95,Botella 1.75L
PlazaVea,Vodka DR. LEMON Lata 473ml,7.95,Botella 1.75L
PlazaVea,Whisky CHIVAS REGAL Ultis Botella 700ml,943.90,Botella 1.75L
PlazaVea,Vino Tinto MARQUÉS DEL ATRIO Rioja Botella 750ml,44.80,Botella 1.75L
PlazaVea,Pisco Quebranta IRREVERENTE Botella 750ml,29.90,Botella 1.75L
PlazaVea,Pisco IRREVERENTE Italia Botella 750ml,29.90,Botella 1.75L
PlazaVea,Vino Borgoña IRREVERENTE Botella 750ml,14.90,Botella 1.75L
PlazaVea,Pisco Acholado IRREVERENTE Botella 750ml,29.90,Botella 1.75L
PlazaVea,Hielo Cocktail BELL'S SELECCIÓN Bolsa 1.8Kg,11.90,Botella 1.75L
PlazaVea,Vino FREIXENET Italian Rosé Botella 750ml,64.90,Botella 1.75L
PlazaVea,Vino Tinto FINCA ROTONDO Gran Reserva Blend Isabel Botella 750ml,75.10,Botella 1.75L
PlazaVea,Vino Blanco MAYOR DE CASTILLA Verdejo Rueda Botella 750ml,39.90,Botella 1.75L
PlazaVea,Vino Tinto FREIXENET Chianti Botella 750ml,64.90,Botella 1.75L
PlazaVea,Vino Blanco FREIXENET Pinot Grigio Botella 750ml,64.90,Botella 1.75L
PlazaVea,Espumante MARTINI Prosecco Botella 750ml,56.90,Botella 1.75L
PlazaVea,Espumante PERLINO Moscato Rosato Botella 750ml,49.90,Botella 1.75L
PlazaVea,Espumante PERLINO Asti Botella 750ml,49.90,Botella 1.75L
PlazaVea,Espumante MARTINI Asti Botella 200ml,23.90,Botella 1.75L
PlazaVea,Espumante MARTINI Asti Vintage Botella 750ml,89.90,Botella 1.75L
PlazaVea,Gin SEAGRAMS Dry Botella 750ml,39.90,Botella 1.75L
PlazaVea,Gin BEEFEATER Orange Botella 700ml,99.90,Botella 1.75L
PlazaVea,Pack Bebida Refrescante de Vino FREIXENET Mia Wine Seltzer Lata 250ml Paquete 4un,39.90,Botella 1.75L
PlazaVea,Sour de Limón MONTESIERPE Lata 473ml,10.90,Botella 1.75L
PlazaVea,Cóctel de Ron Sabor a Cola BACARDÍ RTD Rum & Cola Lata 310ml,8.90,Botella 1.75L
PlazaVea,Sour de Maracuyá MONTESIERPE Lata 473ml,10.90,Botella 1.75L
PlazaVea,Gin & Tonic BOMBAY RTD Lata 250ml,11.90,Botella 1.75L
PlazaVea,Cerveza DOS EQUIS Botella 355ml Paquete 6un,25.90,Botella 1.75L
PlazaVea,Refresco UMSHA Maracuyá Bolsa 13g,1.10,Botella 1.75L
PlazaVea,Vino SANTA HELENA Reservado Cabernet Sauvignon Botella 750ml,20.90,Botella 1.75L
PlazaVea,Bebida Rehidratante SPORADE Tropical Botella 1L,3.90,Botella 1.75L
PlazaVea,Gin BEEFEATER 24 Botella 700ml,159.90,Botella 1.75L
PlazaVea,Vino VOLVER Tarima Monastrell Botella 750ml,54.90,Botella 1.75L
PlazaVea,Vino Tinto EL COTO Reserva Botella 1.5L,163.90,Botella 1.75L
PlazaVea,Vino VOLVER Paso a Paso Cosecha Tempranillo Botella 750ml,44.80,Botella 1.75L
PlazaVea,Vino Blanco OCUCAJE Moscato Semiseco Botella 750ml,18,Botella 1.75L
PlazaVea,Vino VOLVER Juntos Garnacha Botella 750ml,54.90,Botella 1.75L
PlazaVea,Cerveza PUERTO SANTO Botella 330ml Paquete 6un,26.50,Botella 1.75L
PlazaVea,Pack Cerveza CANDELARIA Sunset Lata 355ml Paquete 4un,30,Paquete 4un
PlazaVea,Pack Cerveza BARBARIAN Ipa Lata 269ml Paquete 4un,19.90,Paquete 4un
PlazaVea,Pack Cerveza BARBARIAN 174 Ipa Lata 269ml Paquete 4un,22.90,Paquete 4un
PlazaVea,Pack Cerveza BARBARIAN La Lou Honey Lata 269ml Paquete 4un,19.90,Paquete 4un
PlazaVea,Pack Agua ANDEA sin Gas Botella de Vidrio 330ml Paquete 4un,15.90,Paquete 4un
PlazaVea,Bebida Lista para Tomar SPIRITS Gin Tonic Botella 275ml,7.90,Paquete 4un
PlazaVea,Bebida Lista para Tomar SPIRITS Mojito Botella 275ml,7.90,Paquete 4un
PlazaVea,Bebida Lista para Tomar SPIRITS Vodka Blueberry Botella 275ml,7.90,Paquete 4un
PlazaVea,Whisky THE GLENLIVET Captains Reserve Botella 700ml,159.90,Paquete 4un
PlazaVea,Vino HONORO VERA Garnacha Botella 750ml,64.90,Paquete 4un
PlazaVea,Vino HONORO VERA Verdejo Botella 750ml,64.90,Paquete 4un
PlazaVea,Sangría LOLEA Rosé N°5 Botella 750ml,67.90,Paquete 4un
PlazaVea,Vino HONORO VERA Tempranillo Botella 750ml,64.90,Paquete 4un
PlazaVea,Vino Blanco MARQUÉS DEL ATRIO Rioja Botella 750ml,44.80,Paquete 4un
PlazaVea,Vino SANTA HELENA Reservado Carmenére Botella 750ml,20.90,Paquete 4un
PlazaVea,Vino SOMBRERO Cabernet Franc Botella 750ml,67.90,Paquete 4un
PlazaVea,Pack Cerveza PILSEN Callao Botella 305ml Paquete 6un x 2un,38.90,Paquete 4un
PlazaVea,Cerveza PILSEN Callao Botella 305ml,3.50,Paquete 4un
PlazaVea,Pack Gin London GREENALL'S Botella 750ml + Gin Berry GREENALL'S Botella 750ml,125.90,Paquete 4un
PlazaVea,Pack Espumante TOSTI Asti Botella 750ml Paquete 2un,109.90,Paquete 4un
PlazaVea,Gaseosa KR Naranja Botella 3.03L,5.50,Paquete 4un
PlazaVea,Whisky CHIVAS REGAL 13 Años Botella 1L,144.90,Paquete 4un
PlazaVea,Cerveza TIGER Lata 473ml Paquete 6un,24.90,Paquete 4un
PlazaVea,Pack Gaseosa PEPSI Botella 1.5L + Gaseosa CONCORDIA Piña Botella 1.5L,7.90,Paquete 4un
PlazaVea,Jugo de Naranja EPIC Botella 380ml,4.99,Paquete 4un
PlazaVea,Jugo de Naranja EPIC Botella 250ml,3.69,Paquete 4un
PlazaVea,Jugo de Arándano Piña EPIC Botella 250ml,3.69,Paquete 4un
PlazaVea,Jugo de Aguaymanto Piña EPIC Botella 880ml,11.59,Paquete 4un
PlazaVea,Jugo de Arándano Piña EPIC Botella 380ml,4.99,Paquete 4un
PlazaVea,Jugo de Mango Aguaymanto EPIC Botella 250ml,3.69,Paquete 4un
PlazaVea,Jugo de Mango Aguaymanto EPIC Botella 380ml,4.99,Paquete 4un
PlazaVea,Jugo de Aguaymanto Piña EPIC Botella 380ml,4.99,Paquete 4un
PlazaVea,Jugo de Mango Aguaymanto EPIC Botella 880ml,11.59,Paquete 4un
PlazaVea,Jugo de Aguaymanto Piña EPIC Botella 250ml,3.69,Paquete 4un
PlazaVea,Jugo de Zanahoria Naranja EPIC Botella 250ml,3.69,Paquete 4un
PlazaVea,Jugo de Zanahoria Naranja EPIC Botella 380ml,4.99,Paquete 4un
PlazaVea,Vino ESCORIHUELA GASCON Cabernet Franc Botella 750ml,54.90,Paquete 4un
PlazaVea,Jugo HOOP La Colorada Botella 355ml,6.50,Paquete 4un
PlazaVea,Jugo HOOP La Carrota Botella 355ml,6.50,Paquete 4un
PlazaVea,Jugo HOOP El Yerberito Botella 355ml,6.50,Paquete 4un
PlazaVea,Gin GREENALL'S Pink Wild RTD Lata 250ml,8.90,Paquete 4un
PlazaVea,Gin GREENALL'S Limón Siciliano RTD Lata 250ml,8.90,Paquete 4un
PlazaVea,Gin GREENALL'S Blueberry RTD Lata 250ml,8.90,Paquete 4un
PlazaVea,Vodka ANDEAN Botella 700ml,89.90,Paquete 4un
PlazaVea,Gin & Tonic GORDONS RTD Lata 375ml,7.90,Paquete 4un
PlazaVea,Pisco Mosto Verde FINCA ROTONDO Torontel Botella 750ml,67.90,Paquete 4un
PlazaVea,Pisco Mosto Verde FINCA ROTONDO Italia Botella 750ml,67.90,Paquete 4un
PlazaVea,Pisco Mosto Verde FINCA ROTONDO Quebranta Botella 750ml,67.90,Paquete 4un
PlazaVea,Ron MILLONARIO XO Botella 700ml,425.90,Paquete 4un
PlazaVea,Pisco Mosto Verde FINCA ROTONDO Moscatel Botella 750ml,67.90,Paquete 4un
PlazaVea,Ron MILLONARIO Sistema Solera 15 Botella 700ml,177.90,Botella 700ml
PlazaVea,Gin GENEROUS Botella 750ml,179.90,Botella 700ml
PlazaVea,Vino FINCA ROTONDO Reserva Cabernet Sauvignon Botella 750ml,39.90,Botella 700ml
PlazaVea,Licor de Crema FRANGELICO Botella 700ml,121.90,Botella 700ml
PlazaVea,Vermouth CINZANO Rosso 1797 Botella 1L,92.50,Botella 700ml
PlazaVea,Cerveza CORONA Extra Lata 355ml,6.90,Botella 700ml
PlazaVea,Vino TACAMA Don Manuel Petit Verdot Botella 750ml,85.50,Botella 700ml
PlazaVea,"Vino TACAMA ""O"" Malbec Botella 750ml",69.50,Botella 700ml
PlazaVea,Bebida Rehidratante BODY ARMOR Tropical Punch Botella 16oz,14.90,Botella 700ml
PlazaVea,Bebida Rehidratante BODY ARMOR Orange Mango Botella 16oz,14.90,Botella 700ml
PlazaVea,Bebida Rehidratante BODY ARMOR Fruit Punch Botella 16oz,14.90,Botella 700ml
PlazaVea,Agua Tónica CANADA DRY Lata 355ml,5.90,Botella 700ml
PlazaVea,Licor ABROGATTO 18 Negroni Botella 110ml Paquete 2un,53.90,Botella 700ml
PlazaVea,Espumante FREIXENET Ice Cuvee Botella 750ml,59.90,Botella 700ml
PlazaVea,Vodka MIKE'S Hard Strawberry Lata 355ml,5.50,Botella 700ml
PlazaVea,Cerveza AMSTEL Lata 473ml Paquete 6un,24.90,Botella 700ml
PlazaVea,Pisco Mosto Verde 1615 Italia Botella 700ml,92.90,Botella 700ml
PlazaVea,Pisco Mosto Verde 1615 Quebranta Botella 700ml,92.90,Botella 700ml
PlazaVea,Pisco Mosto Verde 1615 Torontel Botella 700ml,92.90,Botella 700ml
PlazaVea,Vino TRIVENTO Eolo Malbec Botella 750ml,399.90,Botella 700ml
PlazaVea,Vino Tinto VIÑA COBOS Felino Malbec Botella 750ml,83.90,Botella 700ml
PlazaVea,Vino Tinto VIÑA COBOS Felino Cabernet Sauvignon Botella 750ml,83.90,Botella 700ml
PlazaVea,Vino CATENA Alta Chardonnay Botella 750ml,339.90,Botella 700ml
PlazaVea,Vino Tinto GRAN ENEMIGO Botella 750ml,544.90,Botella 700ml
PlazaVea,Vino CATENA Nicasia Malbec Botella 750ml,590,Botella 700ml
PlazaVea,Vino ANGÉLICA ZAPATA Alta Cabernet Sauvignon Botella 750ml,331.90,Botella 700ml
PlazaVea,Vino CATENA Alta Cabernet Sauvignon Botella 750ml,339.90,Botella 700ml
PlazaVea,Whisky VAT 69 Apple Botella 700ml,37.90,Botella 700ml
PlazaVea,Whisky VAT 69 Honey Botella 700ml,37.90,Botella 700ml
PlazaVea,Vino Blanco NORTON Cosecha Tardía Botella 750ml,32.50,Botella 700ml
PlazaVea,Vino Tinto NORTON Cosecha Tardía Botella 750ml,32.50,Botella 700ml
PlazaVea,Cigarro PALL MALL Blue XL Caja 10un,6.60,Botella 700ml
PlazaVea,Bebida Aromatizada con Gas BELL'S Ginger Ale Botella 1.5L,3.90,Botella 700ml
PlazaVea,Gaseosa BELL'S Ginger Cero Azúcar Botella 1.5L,3.90,Botella 700ml
PlazaVea,Pisco BARSOL Quebranta Botella 750ml,61.90,Botella 700ml
PlazaVea,Cerveza Light TRES CRUCES Botella 355ml Paquete 6un,17.90,Botella 700ml
PlazaVea,Cerveza Light TRES CRUCES Lata 473ml Paquete 6un,21.90,Botella 700ml
PlazaVea,Vino SANTA JULIA Flores Blancas Viognier Botella 750ml,42.50,Botella 700ml
PlazaVea,Vino TENSIÓN LA RIBERA Cabernet Sauvignon - Cabernet Franc Botella 750ml,49.90,Botella 700ml
PlazaVea,Vino TENSIÓN LA RIBERA Malbec - Petit Verdoy Botella 750ml,49.90,Botella 700ml
PlazaVea,Vino TENSIÓN LA RIBERA Chardonnay - Semillón Botella 750ml,49.90,Botella 700ml
PlazaVea,Whisky THE GLENLIVET 15 Años Botella 700ml,269.90,Botella 700ml
PlazaVea,Whisky THE GLENLIVET Founders Botella 700ml,119.90,Botella 700ml
PlazaVea,Whisky THE GLENLIVET 18 Años Botella 700ml,458.90,Botella 700ml
PlazaVea,Ginger Ale MR PERKINS Botella 200ml Paquete 4un,19.90,Botella 700ml
PlazaVea,Vino ESCORIHUELA GASCÓN Malbec - Cabernet Sauvignon Botella 750ml,54.90,Botella 700ml
PlazaVea,Vino ESCORIHUELA GASCÓN Gran Reserva Malbec Botella 750ml,99.90,Botella 700ml
PlazaVea,Vino PULENTA La Flor Malbec Botella 750ml,54.90,Botella 700ml
PlazaVea,Vino PULENTA La Flor Cabernet Sauvignon Botella 750ml,54.90,Botella 700ml
PlazaVea,Licor de Crema MOLLY'S Botella 700ml,54.90,Botella 700ml
PlazaVea,Pisco TORO SANTO Botella 750ml,34.90,Botella 750ml
PlazaVea,Gin BROCKMANS Botella 1L,260,Botella 750ml
PlazaVea,Licor PONCHE DE CREMA Botella 750ml,49.90,Botella 750ml
PlazaVea,Vino FINCA LA COLONIA Cabernet Sauvignon Botella 750ml,29.50,Botella 750ml
PlazaVea,Vino FINCA LA COLONIA Malbec Botella 750ml,29.50,Botella 750ml
PlazaVea,Vino FINCA LA COLONIA Coleccón Malbec Botella 750ml,38.50,Botella 750ml
PlazaVea,Vino FINCA LA COLONIA Coleccón Cabernet Botella 750ml,38.50,Botella 750ml
PlazaVea,Cerveza KUNSTMANN Gran Torobayo Botella 500ml,17.50,Botella 750ml
PlazaVea,Cerveza Sin Alcohol ERDINGER Botella 33ml Paquete 4un,40.80,Botella 750ml
PlazaVea,Bebida Rehidratante POWERADE ION 4 Frutas Botella 473ml,1.99,Botella 750ml
PlazaVea,Bebida Rehidratante POWERADE ION 4 Mora Azul Botella 473ml,1.99,Botella 750ml
PlazaVea,Gin MALFY Originale Botella 700ml,129.90,Botella 750ml
PlazaVea,Crema de Licor ANDEAN CREAM Botella 700ml,89.90,Botella 750ml
PlazaVea,Gin MALFY Rosa Botella 700ml,129.90,Botella 750ml
PlazaVea,Gin MALFY Limone Botella 700ml,129.90,Botella 750ml
PlazaVea,Gin MALFY Arancia Botella 700ml,129.90,Botella 750ml
PlazaVea,Whisky BLACK WHISKEY Botella 700ml,199.99,Botella 750ml
PlazaVea,Gin GIN'CA BERRIES Botella 700ml,152,Botella 750ml
PlazaVea,Vino SANTA CRUZ de Alpera Roble Garnacha Tintorera Botella 750ml,54.90,Botella 750ml
PlazaVea,Vino SANTA EMA Select Terrior Reserva Merlot Botella 750ml,44.90,Botella 750ml
PlazaVea,Vino SANTA CRUZ de Alpera Frizzante Azul Botella 750ml,44.90,Botella 750ml
PlazaVea,Vodka ERISTOFF Black Botella 700ml,31.90,Botella 750ml
PlazaVea,Vodka ERISTOFF Golden Botella 700ml,31.90,Botella 750ml
PlazaVea,Vodka ERISTOFF Original Botella 700ml,26.90,Botella 750ml
PlazaVea,Licor de Crema de Chocolate MOZART Botella 700ml,109.90,Botella 750ml
PlazaVea,Vino Tinto FAUSTINO Crianza Botella 750ml,68,Botella 750ml
PlazaVea,Vino Tinto FAUSTINO I Gran Reserva Botella 750ml,204.90,Botella 750ml
PlazaVea,Vino Tinto FAUSTINO V Reserva Botella 750ml,119.90,Botella 750ml
PlazaVea,Vino Tinto SOMBRERO Malbec Botella 750ml,67.90,Botella 750ml
PlazaVea,Vino Tinto GRAN SOMBRERO Malbec Botella 750ml,99.90,Botella 750ml
PlazaVea,Vino tinto TARAPACA Cabernet Sauvignon Botella 750ml,26.90,Botella 750ml
PlazaVea,Vino Chard EUGENIO BUSTOS La Celia Botella 750ml,32.90,Botella 750ml
PlazaVea,Vino Malbec EUGENIO BUSTOS La Celia Botella 750ml,32.90,Botella 750ml
PlazaVea,Cerveza PILSEN TRUJILLO Lata 355ml,3.40,Botella 750ml
PlazaVea,Vino Rosado TAPAS Botella 750ml,24.90,Botella 750ml
PlazaVea,Vino Blanco TAPAS Botella 750ml,24.90,Botella 750ml
PlazaVea,Vino Tinto TAPAS Botella 750ml,24.90,Botella 750ml
PlazaVea,Pisco Mosto Verde BARSOL Italia Botella 750ml,92.90,Botella 750ml
PlazaVea,Pisco Acholado BARSOL Botella 750ml,76.90,Botella 750ml
PlazaVea,Vino Clásico MAURICIO LORCA Chardonnay Botella 750ml,31.90,Botella 750ml
PlazaVea,Gaseosa BELL'S Cola Amarilla Botella 1.5L,3.50,Botella 750ml
PlazaVea,Ron Blanco SANTA TERESA Botella 750ml,44.90,Botella 750ml
PlazaVea,Vino TARAPACA Carmenere Gran Reserva Botella 750ml,73.90,Botella 750ml
PlazaVea,Vino TARAPACA Cabernet Sauvignon Gran Reserva Botella 750ml,73.90,Botella 750ml
PlazaVea,Vino LAGUNILLA Reserva Botella 750ml,71.90,Botella 750ml
PlazaVea,Vino LAGUNILLA Crianza Botella 750ml,56.90,Botella 750ml
PlazaVea,Vino Tinto SONSIERRA Selección Tinto Botella 750ml,31.90,Botella 750ml
PlazaVea,Vino SONSIERRA Reserva Botella 750ml,59.90,Botella 750ml
PlazaVea,Vino PENEDO BORGES Malbec Botella 750ml,44.90,Botella 750ml
PlazaVea,Vino PENEDO BORGES Chardonnay Botella 750ml,44.90,Botella 750ml
PlazaVea,Vino PENEDO BORGES Cabernet Sauvignon Botella 750ml,44.90,Botella 750ml
PlazaVea,Cerveza KAUFMAN Lata 355ml,2.70,Botella 750ml
PlazaVea,Vino MOSQUITA MUERTA Blend de Tintas Botella 750ml,218.90,Botella 750ml
PlazaVea,Vino MOSQUITA MUERTA Sapo de Otro Pozo Blend de Tintas Botella 750ml,179.90,Botella 750ml
PlazaVea,Vino Rosso WAVE Botella 750ml,19.90,Botella 750ml
PlazaVea,Pisco Quebranta GRAN CRUZ Botella 700ml,59.90,Botella 750ml
PlazaVea,Gin BOMBAY Bramble Botella 700ml,99.90,Botella 750ml
PlazaVea,Pisco Acholado GRAN CRUZ Botella 700ml,59.90,Botella 750ml
PlazaVea,Ginger Beer MR PERKINS Light Botella 200ml Paquete 4un,23.90,Botella 750ml
PlazaVea,Espumante CANTI Botella 750ml + Box 2 Copas,69.90,Botella 750ml
PlazaVea,Espumante TOSTI Asti Botella 750ml Paquete 2un,109.90,Botella 750ml
PlazaVea,Cerveza GROLSCH Premium Lager Botella 330ml 6 Pack,32.80,Botella 750ml
PlazaVea,Vino FINCA LA COLONIA Rosado Botella 750ml,27.90,Botella 750ml
PlazaVea,Vino FINCA LA COLONIA Chardonnay Botella 750ml,27.90,Botella 750ml
PlazaVea,Vino Malbec RÍO MENDOZA Botella 750ml,34.90,Botella 750ml
PlazaVea,Vino RÍO MENDOZA Estate Cabernet Sauvignon Botella 750ml,49.90,Botella 750ml
