Local,Nombre,Precio,Cantidad
PlazaVea,Tapenade CASA VERDE Alcachofa Gourmet Frasco 190g,8.90,Doypack 200g
PlazaVea,Endulzante en Polvo BELL'S con Stevia Frasco 60g,16.50,Doypack 200g
PlazaVea,Salsa Huancaína WALIBI Doypack 200g,7.90,Doypack 200g
PlazaVea,Maní con Pasas VILLA NATURA Bolsa 250g,7.99,Doypack 200g
PlazaVea,Guindones sin Pepa VILLA NATURA Bolsa 250g,13.90,Doypack 200g
PlazaVea,Pasas Morenas VILLA NATURA Bolsa 150g,5.50,Doypack 200g
PlazaVea,Pistachos Salados VILLA NATURA Bolsa 80g,11.90,Doypack 200g
PlazaVea,Gusanos Ácidos TROLLI Sour Glowworms Bolsa 50g,3.50,Doypack 200g
PlazaVea,Mixtura sin Sal VILLA NATURA Bolsa 250g,13.80,Doypack 200g
PlazaVea,Pasas Morenas VILLA NATURA Bolsa 250g,7.99,Doypack 200g
PlazaVea,Crema de Pollo BELL'S Paquete 70g,2.20,Doypack 200g
PlazaVea,Comida Instantánea NADÚ Ají de Gallina Empaque 340g,14.50,Doypack 200g
PlazaVea,Galleta de Arroz COSTEÑO Pimienta Doypack 150g,6.79,Doypack 200g
PlazaVea,Aceite de Coco Virgen MI TIERRA Frasco 350g,30.39,Doypack 200g
PlazaVea,Sólido de Atún REAL en Aceite Girasol Lata 170g,7.40,Doypack 200g
PlazaVea,Barra de Chocolate y Galletas WINTER'S Cookies and Cream Empaque 38g,2.50,Doypack 200g
PlazaVea,Sólido de Atún BELL'S en Aceite Vegetal  Lata 170g,6.70,Doypack 200g
PlazaVea,Lomito de Atún BELL'S en Aceite Vegetal Lata 170g,5.69,Doypack 200g
PlazaVea,Aceite de Oliva OLIVOS DEL SUR Extra Virgen Frasco 250ml,19.90,Doypack 200g
PlazaVea,Goma de Mascar TRIDENT Evup Sandía Paquete 18un,3.10,Doypack 200g
PlazaVea,Aceite de Coco OLIVOS DEL SUR Botella 200ml,28.40,Doypack 200g
PlazaVea,Pasta de Tomate CASA RINALDI Frasco 690g,7.90,Doypack 200g
PlazaVea,Chocolate HERSHEY'S Kisses Almendras Caja 74g,12.60,Doypack 200g
PlazaVea,Quinua Perlada Urqu ANDINA CROPS Blanca Doypack 500g,9.99,Doypack 200g
PlazaVea,Chocolate LINDT Leche con Avellanas Paquete 100g,17.70,Doypack 200g
PlazaVea,Aceitunas Verdes en Conserva VALDEPORRES Rellenas de Anchoas Frasco 370g,9.20,Doypack 200g
PlazaVea,Chocolate REESE'S Peanuts Caramel Bolsa 47g,4.10,Doypack 200g
PlazaVea,Chocolate con Leche HERSHEY'S Ao Leite Barra 40g,3.70,Doypack 200g
PlazaVea,Mezcla de Nueces Maní Almendras y Marañones GRANUTS Bolsa 40g,3.50,Doypack 200g
PlazaVea,Salsa Pesto BELL'S Frasco 210g,14,Doypack 200g
PlazaVea,Stevia BELL'S Caja 50un,12.20,Doypack 200g
PlazaVea,Aceituna Manzanilla VALDEPORRES sin Hueso Frasco 240g,8.40,Doypack 200g
PlazaVea,Vinagre CARBONELL Blanco Botella 250ml,6.70,Doypack 200g
PlazaVea,Piqueo BELL'S Papas fritas 185Gr + Piqueo BELL'S Snax 230Gr Paquete 2Un,14,Doypack 200g
PlazaVea,Salsa BBQ Ahumada KRAFT Frasco 496g,15,Doypack 200g
PlazaVea,Salsa de Tomate HELIOS Casero sin Gluten Frasco 300g,13.50,Doypack 200g
PlazaVea,Salsa Vinagreta a la Italiana WALIBI Doypack 200g,6.20,Doypack 200g
PlazaVea,Fideos Tornillo Chico MARCO POLO Bolsa 250g,1.60,Doypack 200g
PlazaVea,Galletas de Agua LIGERITAS para Piqueo Bolsa 110g,9.30,Doypack 200g
PlazaVea,Conserva VALLE FERTIL Champiñón Entero Frasco 310g,13.90,Doypack 200g
PlazaVea,Galletas sin Gluten NOGLUT María Biscuits Bolsa 210g,14,Doypack 200g
PlazaVea,Albaricoques BELL'S Táper 100g,7.90,Doypack 200g
PlazaVea,Goma de Mascar TRIDENT Evup Herbal Paquete 18un,3.10,Doypack 200g
PlazaVea,Galletas sin Gluten NOGLUT Jungla Bolsa 100g,10,Doypack 200g
PlazaVea,Mostaza ALACENA Doypack 100g,3.40,Doypack 200g
PlazaVea,Caramelos HALLS Menta Fuerte Paquete 9un,1.69,Doypack 200g
PlazaVea,Gomas dulces TROLLI Sour gecko Envoltura 22Gr,1.19,Doypack 200g
PlazaVea,Aceite Vegetal PRIMOR Premium Botella 1L,11.50,Botella 1L
PlazaVea,Azúcar Rubia BELL'S Bolsa 4Kg,16.70,Botella 1L
PlazaVea,,,
PlazaVea,,,
PlazaVea,,,
PlazaVea,,,
PlazaVea,,,
PlazaVea,,,
PlazaVea,,,
PlazaVea,,,
PlazaVea,Piqueo BELL'S Papas al hilo Bolsa 220Gr,8.29,Bolsa 220g
PlazaVea,Caramelos HALLS Mentol Paquete 9un,1.69,Bolsa 220g
PlazaVea,Trozos de Atún A1 en Aceite Vegetal Lata 170g,5.60,Bolsa 220g
PlazaVea,Piqueo ACT II Mantequilla light Caja 3Un,11.90,Bolsa 220g
PlazaVea,Piqueo ACT II Natural Caja 3Un,11.90,Bolsa 220g
PlazaVea,Chocolate HAPPINESS Surtidos Caja 400g,15.60,Bolsa 220g
PlazaVea,Chocolate con Leche RITTER SPORT Extrafino Envoltura 100g,14.20,Bolsa 220g
PlazaVea,Wafer BAUDUCCO sabor a Fresa Paquete 140g,4.70,Bolsa 220g
PlazaVea,Wafer BAUDUCCO Sabor a Chocolate Relleno de Vainilla Paquete 140g,4.70,Bolsa 220g
PlazaVea,Chocolate LA IBÉRICA PASTILLAS SURTIDAS De leche y chocolate Caja 180Gr,28.50,Bolsa 220g
PlazaVea,Piqueo BELL'S Cancha Chulpi Picante Bolsa 140g,5.90,Bolsa 220g
PlazaVea,Papas Fritas BELL'S Sabor Queso Lata 150g,7.50,Bolsa 220g
PlazaVea,Papas Fritas BELL'S Sabor BBQ Lata 150g,7.50,Bolsa 220g
PlazaVea,Piqueo BELL'S Papas Camotes y Plátanos Fritos Bolsa 125g,4.20,Bolsa 220g
PlazaVea,Piqueo BELL'S Chifles salados Bolsa 125Gr,4.50,Bolsa 220g
PlazaVea,Bombones COSTA Vizzio Caja 131g,10.50,Bolsa 220g
PlazaVea,Caramelo PUSH POP Surtido Barra 15g,3.49,Bolsa 220g
PlazaVea,Chocolate de Leche en Barra BELGIAN Caja 100g,13.90,Bolsa 220g
PlazaVea,Bombones Surtidos LA IBÉRICA Caja 150g,22.50,Bolsa 220g
PlazaVea,Piqueo KARIÑO Maní tostado Bolsa 80g,4.29,Bolsa 220g
PlazaVea,Aderezo para Pachamanca 2 BANDERAS Doypack 300g,9.40,Bolsa 220g
PlazaVea,Cúrcuma Palillo 4 ESTACIONES Frasco 30g,4.50,Bolsa 220g
PlazaVea,Orégano BADIA Entero Bolsa 14.20g,4.10,Bolsa 220g
PlazaVea,Crema Instantánea KNORR De espárragos Bolsa 68Gr,3.19,Bolsa 220g
PlazaVea,Sopa Instantánea MARUCHAN Pollo Paquete 85g,2.99,Bolsa 220g
PlazaVea,Aderezo tipo Oriental 2 BANDERAS con Soya y Especias Bolsa 85g,2.99,Bolsa 220g
PlazaVea,Chocolate M &M'S De leche confitado Bolsa 1.69Oz,4.90,Bolsa 220g
PlazaVea,Tomillo 4 ESTACIONES Sobre 5g,4.30,Bolsa 220g
PlazaVea,Comino KARIÑO Molido Sobre 18Gr,3.70,Bolsa 220g
PlazaVea,Hongos y laurel KARIÑO Sobre 12Gr,4.60,Bolsa 220g
PlazaVea,Chocolate LA IBÉRICA PASTILLAS FONDANDT Semi dulce sin leche Caja 300Gr,30,Bolsa 220g
PlazaVea,Chocolate 2 CERRITOS Coco Monedas de Oro Bitter Bolsa 125g,12.10,Bolsa 220g
PlazaVea,Azúcar Morena Light INCAUCA con Stevia Bolsa 850g,14.30,Bolsa 220g
PlazaVea,Chocolate de Leche TOBLERONE Envoltura 400g,44.50,Bolsa 220g
PlazaVea,Chocolate TOBLERONE Suizo con Nougat y Almendras Caja 50g,7.40,Bolsa 220g
PlazaVea,Endulzante Natural NUTRA STEVIA en Polvo Caja 50 Sobres,14.59,Bolsa 220g
PlazaVea,Chocolate ORQUIDEA Bitter Envoltura 90Gr,15.20,Bolsa 220g
PlazaVea,Chocolate con Leche ORQUIDEA Envoltura 90g,15.20,Bolsa 220g
PlazaVea,Galletas COLOMBINA Butters cookies De mantequilla Bolsa 280Gr,6.50,Bolsa 220g
PlazaVea,Chupetes AMBROSOLI Surtidos Bolsa 25un,8.30,Bolsa 220g
PlazaVea,Toffees STORCK Eclair Bolsa 100g,7,Bolsa 220g
PlazaVea,Gomas Dulces 2 CERRITOS sabor a Eucalipto Bolsa 125g,9.90,Bolsa 220g
PlazaVea,Marshmallow COLOMBINA Millows sabores Frutado forma de Margarita Bolsa 145g,4.70,Bolsa 220g
PlazaVea,Caramelos Ring Pop TOPPS Surtidos Unidad 14g,2.10,Bolsa 220g
PlazaVea,Galletas NUTRI DELI de Maca Bolsa 70g,2.40,Bolsa 220g
PlazaVea,Bombones FERRERO ROCHER Caja 100g,27.90,Bolsa 220g
PlazaVea,Piqueo VILLA NATURA Camote frito en hojuelas Bolsa 150g,5.90,Bolsa 220g
PlazaVea,Gomas Dulces 2 CERRITOS Sabor Fresa Naranja Limón y Piña Bolsa 125g,9.90,Bolsa 220g
PlazaVea,Sal BIOSAL Liviana en sodio Frasco 125g,4.20,Bolsa 220g
PlazaVea,Sal BIOSAL 50% Menos Sodio Pote 850g,16.10,Bolsa 220g
PlazaVea,Aderezo Casero EL OLIVAR Doypack 200g,5.70,Doypack 200g
PlazaVea,Pimienta Negra Entera DROGHERIA & ALIMENTARI Frasco 50g,12.70,Doypack 200g
PlazaVea,Aderezo Criollo 2 BANDERAS Bolsa 90g,2.99,Doypack 200g
PlazaVea,Hongos y laurel 4 ESTACIONES Sobre 10Gr,4.20,Doypack 200g
PlazaVea,Hierbas Finas 4 ESTACIONES Sobre 12g,7.70,Doypack 200g
PlazaVea,Pimienta TOÑA Negra molida Frasco 50Gr,9.49,Doypack 200g
PlazaVea,Comino TOÑA Molido Frasco 50Gr,6.59,Doypack 200g
PlazaVea,Pimentón KARIÑO Paprika Sobre 15Gr,4.60,Doypack 200g
PlazaVea,Romero KARIÑO Romero Sobre 8Gr,3.49,Doypack 200g
PlazaVea,Pimienta KARIÑO Blanca molida Sobre 18Gr,3.39,Doypack 200g
PlazaVea,Trufas de Chocolate HELENA Caja 115g,23.90,Doypack 200g
PlazaVea,Conserva VALLE FERTIL Vegetales mixtos Frasco 425Gr,7.99,Doypack 200g
PlazaVea,Aceite de Oliva HUERTO ALAMEIN Extra Virgen Selección Especial Botella 500ml,23.39,Doypack 200g
PlazaVea,Aceite de Oliva ACAVILLE Extra Virgen Gourmet Botella 250ml,11.90,Doypack 200g
PlazaVea,Aceite de Oliva ACAVILLE Extra Virgen Botella 500ml,19.90,Doypack 200g
PlazaVea,Aceite de Oliva BELL'S Puro Botella 200ml,7.90,Doypack 200g
PlazaVea,Conserva CALE Aceitunas y alcachofas Frasco 185g,10.20,Doypack 200g
PlazaVea,Endulzante SUGAFOR en Polvo Caja 100 Sobres,30.39,Doypack 200g
PlazaVea,Conserva VALLE FERTIL Corazón de Alcachofa Frasco 410g,13.90,Doypack 200g
PlazaVea,Azucar Morena INCAUCA Light Caja 100un,10.90,Doypack 200g
PlazaVea,Arroz Extra BELL'S Selección Bolsa 750g,3.50,Doypack 200g
PlazaVea,Aceite de Oliva ACAVILLE Extra Virgen Gourmet Botella 500ml,23,Doypack 200g
PlazaVea,Endulzante SUGAFOR en Polvo Caja 50 Sobres,17.40,Doypack 200g
PlazaVea,Conserva VALLE FERTIL Pimiento piquillo Frasco 290Gr,9.19,Doypack 200g
PlazaVea,Aceitunas negras en Conserva CALÉ De botija extra entera Frasco 240g,7.50,Doypack 200g
PlazaVea,Aceite de Soya BASSO Botella 1L,12.20,Doypack 200g
PlazaVea,Aceitunas en Conserva OLIVOS DEL SUR De botija deshuesada Doypack 500g,16.50,Doypack 200g
PlazaVea,Aceite de Oliva HUERTO ALAMEIN Extra Virgen Spray 275ml,15.29,Doypack 200g
PlazaVea,Edulcorante BELL’S Dispensador 330 Tabletas,23.50,Doypack 200g
PlazaVea,Conserva CALÉ TAPENADE Mix de aceitunas Frasco 185g,10.20,Doypack 200g
PlazaVea,Conserva VALLE FERTIL Alcaparras encurtidas Frasco 100Gr,10.29,Doypack 200g
PlazaVea,Aceite de Oliva OLIVOS DEL SUR Puro Botella 1L,36.90,Doypack 200g
PlazaVea,Aceite de Oliva OLIVOS DEL SUR Extra Virgen Botella 200ml,14.99,Doypack 200g
PlazaVea,Aceitunas en Conserva BELL'S Botija en rodajas Bolsa 250Gr,5.30,Doypack 200g
PlazaVea,Aceite de Oliva BELL'S Extra Virgen Botella 200ml,11.69,Doypack 200g
PlazaVea,Conserva CALE Aceitunas al ají Frasco 185g,10.20,Doypack 200g
PlazaVea,Aceite de Ajonjolí GATTI Extra Virgen Botella 250ml,24.70,Doypack 200g
PlazaVea,Aceite Vegetal MAZOLA Canola y Girasol Spray 142g,21.59,Doypack 200g
PlazaVea,Aceite de Maíz MAZOLA Botella 710ml,26.50,Doypack 200g
PlazaVea,Aceite de Oliva HUERTO ALAMEIN Puro Botella 500ml,20.90,Doypack 200g
PlazaVea,Tortillas Fritas de Maíz DORITOS Queso Fuego Bolsa 85g,5,Doypack 200g
PlazaVea,Filete de Atún REAL en Aceite Girasol Lata 140g,6.40,Doypack 200g
PlazaVea,Trozos de Atún REAL en Aceite Girasol Lata 140g,6.20,Doypack 200g
PlazaVea,Chocolate NESTLÉ Sublime Bitter Paquete 38g,2.50,Doypack 200g
PlazaVea,Chocolate NESTLÉ Sublime Extremo Paquete 50g,2.90,Doypack 200g
PlazaVea,Yucas Saladas CROCANTITOS Bolsa 250g,8.89,Doypack 200g
PlazaVea,Sopa Instantánea NISSIN Cup Noodles Sabor a Queso Cheddar Vaso 69g,4.57,Doypack 200g
PlazaVea,Caramelos Masticables MENTOS Limón Caja 14un,19.50,Doypack 200g
PlazaVea,Salsa Honey Mustard HUELLA VERDE Pote 350ml,17.50,Doypack 200g
PlazaVea,Trigo Mote MAIMBRO Bolsa 500g,3.80,Doypack 200g
PlazaVea,Chips de Quinua Picante TIYAPUY Bolsa 100g,6,Bolsa 100g
PlazaVea,Wafer COLOMBINA Bridge Sabor a Vainilla Paquete 68g,1.40,Bolsa 100g
PlazaVea,Papas LAY'S Artesanas Sal Marina Bolsa 135g,7.50,Bolsa 100g
PlazaVea,Galleta con Caramelo BISCOLATA Break Display 24un,1,Bolsa 100g
PlazaVea,Sopa de Lentejas BELL'S Mezcla Deshidratada Bolsa 84g,2.60,Bolsa 100g
PlazaVea,Mini Chocolate Super SAPITO Bolsa 275g,11.95,Bolsa 100g
PlazaVea,Mostaza RICASA Doypack 100g,1.59,Bolsa 100g
PlazaVea,Orégano Entero LOPESA Sobre 10g,2.50,Bolsa 100g
PlazaVea,Hongos Enteros LOPESA Sobre 13g,3.20,Bolsa 100g
PlazaVea,Aceituna Verde Rellena con Rocoto OLIVALLE Balde 350g,13.90,Bolsa 100g
PlazaVea,Aceituna Verde Rellena con Pimiento OLIVALLE Balde 350g,13.90,Bolsa 100g
PlazaVea,Aceituna Verde Rellena con Castañas OLIVALLE Balde 350g,16.90,Bolsa 100g
PlazaVea,Cocktail de Nueces VILLA NATURA Nuts & Berry Bolsa 250g,17.90,Bolsa 100g
PlazaVea,Piqueo Mix VILLA NATURA Bolsa 400g,14.90,Bolsa 100g
PlazaVea,Maní Oriental SNACT Bolsa 100g,2.50,Bolsa 100g
PlazaVea,Chips de Garbanzos ANDE BAR Bolsa 150g,9,Bolsa 100g
PlazaVea,Endulzante VÍA en base a Fruto del Bosque Caja 50un,15.50,Bolsa 100g
PlazaVea,Quinua Bicolor CASAVERDE Pouch 375g,10.70,Bolsa 100g
PlazaVea,Chips DELITIERRA Mix Cacao con Pasas Morenas Bolsa 150g,11.99,Bolsa 100g
PlazaVea,Hummus de Pimiento Piquillo OLIVOS DEL SUR Frasco 220g,15.90,Bolsa 100g
PlazaVea,Papas al Hilo BUCKY Bolsa 180g,7.10,Bolsa 100g
PlazaVea,Fideo Fettuccini al Huevo DIVELLA Bolsa 500g,15.80,Bolsa 100g
PlazaVea,Fideo Spaghetti Integral DIVELLA Bolsa 500g,11.40,Bolsa 100g
PlazaVea,Endulzante Natural LAKANTO Sweetener Golden Doypack 800g,95,Bolsa 100g
PlazaVea,Aceite de Cártamo OLEICO Botella 946ml,23.90,Bolsa 100g
PlazaVea,Piña Golden en Trozos COMPASS Lata 425g,6.80,Bolsa 100g
PlazaVea,Piqueos VILLA NATURA Mix Clásico con Berry Pote 200g,10.90,Bolsa 100g
PlazaVea,Piqueos VILLA NATURA Cocktail con Nueces Pote 200g,11.90,Bolsa 100g
PlazaVea,Galletas RELLENITAS de Chocolate Paquete 90g,2.10,Bolsa 100g
PlazaVea,Crema de Tomate BELL'S Mezcla Deshidratada Bolsa 68g,2.60,Bolsa 100g
PlazaVea,Sopa de Cebolla BELL'S Mezcla Deshidratada Bolsa 65g,2.60,Bolsa 100g
PlazaVea,Hojuelas de Papas Fritas LAY'S Clásicas Bolsa 85g,4.10,Bolsa 100g
PlazaVea,Chocolate HERSHEY'S 40% Cacao Barra 92g,6.89,Bolsa 100g
PlazaVea,Tableta de Chocolate MILKY con Almendras Paquete 100g,16.50,Bolsa 100g
PlazaVea,Chocotón D'ONOFRIO Doble Chocolate Caja 500g,22.90,Bolsa 100g
PlazaVea,Quinua Tricolor TIYAPUY Orgánica Doypack 340g,8.80,Bolsa 100g
PlazaVea,Fideo Quinua TIYAPUY Tagliatelle 3.3 Caja 500g,9.79,Bolsa 100g
PlazaVea,Caramelos HALLS Yerbabuena - Lyptus Paquete 25.2g,1.69,Bolsa 100g
PlazaVea,Arroz Carnaroli SCOTTI con Trufas Bolsa 210g,12.69,Bolsa 100g
PlazaVea,Salsa Picante AKIKEPIKE Crema de Rocoto Frasco 300g,16.50,Bolsa 100g
PlazaVea,Fideo Tornillo TIYAPUY Súper Alimento Natural Caja 250g,4.99,Bolsa 100g
PlazaVea,Salsa Teriyaki ESSENTIAL EVERYDAY Botella 295ml,15.49,Bolsa 100g
PlazaVea,Quinua Blanca INCATRAIL Bolsa 500g,10.30,Bolsa 100g
PlazaVea,Mix Clásico Berry VILLA NATURA Táper 500g,26.90,Bolsa 100g
PlazaVea,Chocolate HERSHEY'S Milk Chips Bolsa 326g,22.30,Bolsa 100g
PlazaVea,Chocolate WINTERS Tripack Flow,6.50,Bolsa 100g
PlazaVea,Dark Chocolate YARA Nibbs 75% Caja 80g,12.50,Bolsa 100g
PlazaVea,Salsa de Soya ADELMI Shoyu Frasco 280g,6.10,Bolsa 100g
PlazaVea,Ventana Corazón Bon o Bon ARCOR Chocolina Caja 75g,6.30,Bolsa 100g
PlazaVea,Caja Prisma Bon O Bon ARCOR Paquete 75g,6.30,Bolsa 100g
PlazaVea,Mostaza COMPASS con Chisguete Frasco 200g,4.30,Frasco 200g
PlazaVea,Zanahoria Baby ASPERIO Frasco 370g,8.40,Frasco 200g
PlazaVea,Cocktail de Encurtidos ASPERIO Frasco 370g,8.40,Frasco 200g
PlazaVea,Cebollitas Blancas ASPERIO Frasco 370g,8.40,Frasco 200g
PlazaVea,Pepinillos ASPERIO Sabor Anchoa Frasco 370g,8.40,Frasco 200g
PlazaVea,Galletas Marmoleadas ANA AVELLANA Pote 250g,24.90,Frasco 200g
PlazaVea,Galletas de Naranja ANA AVELLANA Pote 250g,24.90,Frasco 200g
PlazaVea,Fideo Nutritivo Tagliatelle TIYAPUY Caja 500g,6.90,Frasco 200g
PlazaVea,Guindones sin Pepa VILLA NATURA Bolsa 500g,25.90,Frasco 200g
PlazaVea,Sazonador BADIA Italiano Frasco 35.4g,21.20,Frasco 200g
PlazaVea,Chili BADIA en Polvo Frasco 77.9g,9.90,Frasco 200g
PlazaVea,Condimento BADIA Garam Masala Frasco 120g,21.99,Frasco 200g
PlazaVea,Pimienta Negra Molido Grueso MCCORMICK Frasco 42.5g,9,Frasco 200g
PlazaVea,Pimienta Negra Molinillo MCCORMICK Frasco 28g,11.60,Frasco 200g
PlazaVea,"Arroz con Pollo, Seco o Aguadito PROVENZAL Sachet 58g",6.50,Frasco 200g
PlazaVea,Carapulcra PROVENZAL Sachet 150g,7.10,Frasco 200g
PlazaVea,Arroz Extra GRAN CHALAN Bolsa 750g,3.60,Frasco 200g
PlazaVea,Chicha de Jora LORENZA Botella 750ml,13.70,Frasco 200g
PlazaVea,Tomate Pelati MUTTI Lata 400g,13.50,Frasco 200g
PlazaVea,Aceite de Oliva CREMONINI Extra Virgen Botella 1L,59.90,Frasco 200g
PlazaVea,Chocolate SAPITO Mini Oblea de Colores Bolsa 312g,10.90,Frasco 200g
PlazaVea,Grated de Atún BELL'S en Aceite Vegetal Paquete 6un,15,Frasco 200g
PlazaVea,Aceite de Oliva VALDEPORRES Extra Virgen Botella 5L,140.90,Frasco 200g
PlazaVea,Lenteja Cocida LA FONDOSA Caja 500g,5.20,Frasco 200g
PlazaVea,Tallarín NISSIN Sabor Filetto Bolsa 89g,2,Frasco 200g
PlazaVea,Mostaza B&D Frasco 220g,3.49,Frasco 200g
PlazaVea,Salsa Inglesa B&D Botella 500ml,8.99,Frasco 200g
PlazaVea,Galletas BAUDUCCO Chocolate Chips Paquete 100g,5.10,Frasco 200g
PlazaVea,Aderezo DELGA-C Renchero Doypack 200g,5.90,Frasco 200g
PlazaVea,Mayonesa YBARRA Frasco 225ml,5.29,Frasco 200g
PlazaVea,Salsa Alioli YBARRA Frasco 225ml,5.29,Frasco 200g
PlazaVea,Cocktail de Frutas FRUTO DE ORO Lata 820g,12.20,Frasco 200g
PlazaVea,Arroz con Pollo NADU Bandeja 320g,14.50,Frasco 200g
PlazaVea,Cashews BELL'S Táper 200g,24,Frasco 200g
PlazaVea,Chocolate Bitter INNATO Cranberries y Sal Bolsa 100g,12.30,Frasco 200g
PlazaVea,Láminas de Chocolate INNATO con Almendras y Sal Bolsa 50g,12.80,Frasco 200g
PlazaVea,Goma de Mascar con Centro Líquido MENTOS Spearmint Frasco 30g,7.20,Frasco 200g
PlazaVea,Goma de Mascar con Centro Líquido MENTOS Fresh Mint Frasco 30g,7.20,Frasco 200g
PlazaVea,Fideos MOLINOS DEL MUNDO Fetuccini Sin Gluten Bolsa 400g,19.30,Frasco 200g
PlazaVea,Turrón Blando SAN ANDRÉS Suprema Caja 150g,12.90,Frasco 200g
PlazaVea,Salsa Acevichada ADELMI a base de Mayonesa y Especias Frasco 240g,7.80,Frasco 200g
PlazaVea,Salsa Picante SABORES DE LA SELVA Ají Pipí de Mono Botella 90ml,15.70,Frasco 200g
PlazaVea,Aceite de Oliva MANTOVA Extra Virgen Spray 200ml,17.90,Frasco 200g
PlazaVea,Vinagre Tinto SIBARITA Botella 500ml,2.45,Frasco 200g
PlazaVea,Bombones de Chocolate BACI PERUGINA Milk Avellanas Bolsa 143g,29.90,Frasco 200g
PlazaVea,Salsa WALIBI Rocoto Doypack 1Kg,23.69,Frasco 200g
PlazaVea,Comida Instantánea NADÚ Pollo Teriyaki con Arroz Thai Empaque 320g,14.50,Frasco 200g
PlazaVea,Comida Instantánea NADÚ Lasagna con Salsa Bolognesa Empaque 320g,14.50,Frasco 200g
PlazaVea,Salsa WALIBI Huancaína Doypack 1Kg,27.29,Frasco 200g
PlazaVea,Dip Pimiento Piquillo CASA VERDE Gourmet Frasco 200g,7,Frasco 200g
PlazaVea,Aceite Vegetal PRIMOR Premium Botella 1L,11.50,Botella 1L
PlazaVea,,,
PlazaVea,,,
PlazaVea,,,
PlazaVea,,,
PlazaVea,,,
PlazaVea,,,
PlazaVea,,,
PlazaVea,,,
PlazaVea,,,
PlazaVea,Castañas BELL'S Táper 100g,8.29,Táper 100g
PlazaVea,Nueces Peladas BELL'S Táper 100g,9.70,Táper 100g
PlazaVea,Maíz Cancha KUSKI Bolsa 425g,9.59,Táper 100g
PlazaVea,Vinagre de Manzana BELL'S Botella 500ml,7.10,Táper 100g
PlazaVea,Mayonesa KRAFT Light libre de grasa Frasco 443Ml,16.20,Táper 100g
PlazaVea,Vinagreta EL OLIVAR Light a la mostaza Botella 340Ml,15.50,Táper 100g
PlazaVea,Fideo Farfalle BARILLA Caja 500g,9.70,Táper 100g
PlazaVea,Fideos AGNESI Fettucine Flat Bolsa 500g,13.60,Táper 100g
PlazaVea,Galletas GULLON Barquillo Crema Chocolate Paquete 3un,15.10,Táper 100g
PlazaVea,Gomas Dulces TROLLI Lunch Bag Bolsa 77g,5.70,Táper 100g
PlazaVea,Piqueo VALLE NATURA Maní con pasas Táper 250Gr,7.99,Táper 100g
PlazaVea,Chocolate Negro RITTER SPORT Semi Amargo Envoltura 100g,11.50,Táper 100g
PlazaVea,Piqueo BELL'S Maní con Pasas Táper 140g,4.70,Táper 100g
PlazaVea,Chocolate PRINCESA Nestlé Relleno con Crema de Maní Caja 192g,21.50,Táper 100g
PlazaVea,Galletas de Arroz Tradicionales KUPIEC Rice Cakes Paquete 90g,13.90,Táper 100g
PlazaVea,Marshmallows COLOMBINA Arco Iris Bolsa 145g,4.70,Táper 100g
PlazaVea,Gomas Dulces GRISSLY sabor a Sandía Bolsa 100g,4.20,Táper 100g
PlazaVea,Chocolate 2 CERRITOS Cereal bañado en chocolate Bolsa 125Gr,9.90,Táper 100g
PlazaVea,Chocolate con Leche MILKA Happy Cows Blanco de los Alpes Bolsa 100g,14.69,Táper 100g
PlazaVea,Gomas Dulces TROLLI NEON SQUIGGIES sabores Surtidos Bolsa 100g,4.50,Táper 100g
PlazaVea,Maíz Pop Corn PLANET POP Extra Mantequilla Bolsa 85g,3.70,Táper 100g
PlazaVea,Salsa tipo Tamarindo 2 BANDERAS con Pasta de Tomate Bolsa 100g,2.69,Táper 100g
PlazaVea,Pimienta Roja Picada BADIA Sobre 14.2g,4.10,Táper 100g
PlazaVea,Aderezo para Pavo PIKI Doypack 100g,2.99,Táper 100g
PlazaVea,Aderezo PIKI para Carne de Pavo Doypack 350g,8.40,Táper 100g
PlazaVea,Pimienta KARIÑO Negra molida Sobre 18Gr,5.50,Táper 100g
PlazaVea,Galletas FIBRA LIGHT de Salvado de Trigo Bolsa 200g,6.80,Táper 100g
PlazaVea,Azafrán KARIÑO Sobre 4g,6.60,Táper 100g
PlazaVea,Chocolate TOBLERONE Suizo con Leche y Miel Bolsa 200g,28.50,Táper 100g
PlazaVea,Aderezo para Carne de Cerdo PIKI Bolsa 100g,2.99,Táper 100g
PlazaVea,Bombones 2 CERRITOS Chocolate Caja 150g,18.40,Táper 100g
PlazaVea,Galletas Integrales FIBRA LIGHT de Salvado de Trigo Paquete 70g,2.10,Táper 100g
PlazaVea,Piqueo BANANA CHIPS Hojuelas de plátano Bolsa 250Gr,8.90,Táper 100g
PlazaVea,Aderezo de Pollo PIKI Doypack 350g,9.40,Táper 100g
PlazaVea,Chocolate 2 CERRITOS Choco Monedas de Plata Bitter Bolsa 125g,11.99,Táper 100g
PlazaVea,Puré BELL'S De camotes Frasco 470Gr,6.90,Táper 100g
PlazaVea,Orégano Molido 4 ESTACIONES Frasco 22g,5.80,Táper 100g
PlazaVea,Pimienta KARIÑO Blanca molida Frasco 40Gr,8.70,Táper 100g
PlazaVea,Aderezo para Pollo PIKI Doypack 100g,2.99,Táper 100g
PlazaVea,Pimienta KARIÑO Negra entera Sobre 17Gr,3.70,Táper 100g
PlazaVea,Pimienta Blanca Molida BELL'S Sobre 15g,3.10,Táper 100g
PlazaVea,Azúcar Light INCAUCA con Stevia Bolsa 850g,14.30,Táper 100g
PlazaVea,Endulzante VIDA STEVIA Frasco 180g,53.29,Táper 100g
PlazaVea,Tapenade de Aceituna CALE Agridulce Frasco 185g,10.20,Táper 100g
PlazaVea,Endulzante Natural STEVITA en Polvo Caja 150 Sobres,45.49,Táper 100g
PlazaVea,Espárragos Blancos en Conserva VALLE FERTIL Frasco 360g,13.20,Táper 100g
PlazaVea,Aceite de ManÍ BASSO Botella 1L,18.40,Táper 100g
PlazaVea,Piña en Rodajas BALI Lata 836g,13.90,Táper 100g
PlazaVea,Conserva DEL MONTE Tomate diced Frasco 14.5Oz,8.80,Táper 100g
PlazaVea,Endulzante SUGAFOR Dispensador 440 Tabletas,38,Táper 100g
PlazaVea,Piqueo ACT II Mantequilla Bolsa 3Oz,4.10,Bolsa 3Oz
PlazaVea,Chocolates NESTLÉ Kit Kat Capuccino Paquete 6un,22.90,Bolsa 3Oz
PlazaVea,Chocolate NESTLÉ Sublime sin Azúcar Bolsa 38g,3.50,Bolsa 3Oz
PlazaVea,Fideos Tallarín LAVAGGI Bolsa 450g,4,Bolsa 3Oz
PlazaVea,Mostaza ALPESA Doypack 190g,3.60,Bolsa 3Oz
PlazaVea,Mostaza ALPESA Doypack 80g,2.10,Bolsa 3Oz
PlazaVea,Mayonesa ALPESA Doypack 75g,3.60,Bolsa 3Oz
PlazaVea,Mayonesa ALPESA Doypack 350g,7.60,Bolsa 3Oz
PlazaVea,Ketchup ALPESA Doypack 80g,2.10,Bolsa 3Oz
PlazaVea,Ají Criollo ALPESA Doypack 380g,8.60,Bolsa 3Oz
PlazaVea,Ají Criollo ALPESA Doypack 80g,3.60,Bolsa 3Oz
PlazaVea,Papas LAY'S Clásicas Bolsa 70g,4,Bolsa 3Oz
PlazaVea,Tortillas Fritas de Maíz DORITOS Queso Fuego Bolsa 210g,9,Bolsa 3Oz
PlazaVea,Sal de Maras Ahumada LEGENDARIA Frasco 100g,20.30,Bolsa 3Oz
PlazaVea,Sal de Maras Rosada LEGENDARIA Frasco 100g,19.80,Bolsa 3Oz
PlazaVea,Sal de Maras con Finas Hierbas LEGENDARIA Frasco 100g,20.30,Bolsa 3Oz
PlazaVea,Sal de Maras con Paprika LEGENDARIA Frasco 100g,20.30,Bolsa 3Oz
PlazaVea,Sal de Maras Tres Pimientas LEGENDARIA Frasco 100g,20.30,Bolsa 3Oz
PlazaVea,Chocolate NESTLÉ Sublime Bombones Especial Caja 16un,13,Bolsa 3Oz
PlazaVea,Aceite Vegetal CIL Botella 900ml,11.50,Bolsa 3Oz
PlazaVea,Sólido de Atún REAL en Agua Lata 140g,7.10,Bolsa 3Oz
PlazaVea,Sólido de Atún REAL en Aceite Girasol Lata 140g,7.40,Bolsa 3Oz
PlazaVea,Chocolate en Barra LA IBÉRICA Milky Pecanas y Pasas Paquete 6un,39,Bolsa 3Oz
PlazaVea,Chocolate LA IBÉRICA Fondy Caja 50g,6.70,Bolsa 3Oz
PlazaVea,Chocolate en Barra LA IBÉRICA Milky Pecanas y Pasas Paquete 50g,6.70,Bolsa 3Oz
PlazaVea,Pack Piqueos TIYAPUY Natural Bolsa 160g + Piqueos TIYUPAY Quinua Bolsa 100g,10.90,Bolsa 3Oz
PlazaVea,Chocolate NESTLÉ Triangúlo Marmoleado Paquete 30g,1.60,Bolsa 3Oz
PlazaVea,Chocolate Bombon NIKOLO Bolsa 630g,29.90,Bolsa 3Oz
PlazaVea,Chocolates 2 CERRITOS Monedas 1 Choco Sol Bolsa 250g,12.10,Bolsa 3Oz
PlazaVea,Chocolates 2 CERRITOS Monedas Choco Sol Bolsa 250g,12.80,Bolsa 3Oz
PlazaVea,Chocolate NESTLÉ Sublime Aniversario Paquete 6un,14.90,Bolsa 3Oz
PlazaVea,Chocolate NESTLÉ Sublime Almendra Paquete 50g,2.90,Bolsa 3Oz
PlazaVea,Chocolate Blanco NESTLÉ Sublime Sonrisa Paquete 38g,2,Bolsa 3Oz
PlazaVea,Salsa Napolitana CIRIO Frasco 420g,12.90,Bolsa 3Oz
PlazaVea,Salsa Rústica CIRIO Arrabbiata Frasco 420g,12.90,Bolsa 3Oz
PlazaVea,Chocolate COSTA Vizzio Bolsa 21g,15.80,Bolsa 3Oz
PlazaVea,Camotes CROCANTITOS Bolsa 150g,5.49,Bolsa 3Oz
PlazaVea,Chifles Picantes CROCANTITOS Bolsa 250g,8.59,Bolsa 3Oz
PlazaVea,Chocolate con Galleta INNATO Doypack 100g,13.50,Bolsa 3Oz
PlazaVea,Trozos de Galletas NABISCO Oreo Bolsa 500g,12.30,Bolsa 3Oz
PlazaVea,Fideos Konjac BELL'S Bolsa 350g,5.50,Bolsa 3Oz
PlazaVea,Goma de Mascar TRIDENT Splash Menta Bolsa 17.1g,3.20,Bolsa 3Oz
PlazaVea,Goma de Mascar TRIDENT Splash Yerbabuena Bolsa 17.1g,3.20,Bolsa 3Oz
PlazaVea,Chocolate Original BACI Corazón Bolsa 75g,22.90,Bolsa 3Oz
PlazaVea,Chocolate con Leche BACI Corazón Bolsa 75g,22.90,Bolsa 3Oz
PlazaVea,Chocolates BON O BON Blanco Pote 225g,23.90,Bolsa 3Oz
PlazaVea,Chocolates SORINI Pralines Bolsa 500g,26,Bolsa 3Oz
PlazaVea,Chocolates SORINI Sorinette Botella 280g,41.10,Bolsa 3Oz
PlazaVea,Snack TRUNUTS Greenmix Caja 6un,11.90,Bolsa 3Oz
PlazaVea,Snack TRUNUTS Yellowmix Bolsa 30g Caja 6un,11.90,Bolsa 3Oz
PlazaVea,Snack TRUNUTS Bluemix Bolsa 25g Caja 6un,11.90,Caja 6un
PlazaVea,Salsa Dijon Vinaigrette HUELLA VERDE Pote 350ml,17.50,Caja 6un
PlazaVea,Salsa de Barbacoa y Miel KRAFT Pote 510g,15.90,Caja 6un
PlazaVea,Aceite de Orujo BELL'S Botella 1L,16.90,Caja 6un
PlazaVea,Sopa Instántanea NISSIN- CUP Noodles Sabor a Pollo Vaso 69g,4.58,Caja 6un
PlazaVea,Sopa Instántanea NISSIN- CUP Noodles Sabor a Verduras Vaso 67g,4.58,Caja 6un
PlazaVea,Sopa Instántanea NISSIN- CUP Noodles Frutos del Mar Vaso 65g,4.58,Caja 6un
PlazaVea,Salsa de Tomate A1 Doypack 160g,1.39,Caja 6un
PlazaVea,Snack NATURE'S HEART Mix Proteina Doypack 250g,16.90,Caja 6un
