Local,Nombre,Precio,Cantidad
PlazaVea,Pack Jamón Pizza BRAEDT Queso Edam Paquete 370g,13.90,Paquete 2un
PlazaVea,Pack FRUGOS Néctar Durazno Caja 1.5L x 2un,8,Paquete 2un
PlazaVea,Pack Hot Dog SUIZA Paquete 200g + 440g,14.90,Paquete 2un
PlazaVea,Pack Filete de Atún FLORIDA en Aceite Vegetal 150g Lata 3un,16.98,Paquete 2un
PlazaVea,Pack Conserva PRIMOR Filete de Atún en Aceite Vegetal Lata 170g Paquete 3un,16.98,Paquete 2un
PlazaVea,Jamón Pizzero BRAEDT Paquete 480g,12.90,Paquete 2un
PlazaVea,Pack SAN FERNANDO Jamón Sándwich + Queso Edam Paquete 360g,13.40,Paquete 2un
PlazaVea,Tocino Ahumado OTTO KUNZ Paquete 100g,8.50,Paquete 2un
PlazaVea,Yogurt LAIVE con Cultivos Probióticos Fresa Galonera 1.8Kg,11.10,Paquete 2un
PlazaVea,Pack Yogurt Griego GLORIA con Miel Vaso 120g Paquete 4un,6,Paquete 2un
PlazaVea,Pack NIVEA Crema Luminous Anti-Manchas Noche 50ml + Crema Luminous Contorno Ojos Tubo 15ml + Fluido Antimanchas Cellular 40ml,117.50,
PlazaVea,Pack Crema de Tratamiento L'OREAL Revitalift Frasco 30ml + Crema de Tratamiento L'ORÉAL UV Defender Anti-Brillo Frasco 40g,109.90,
PlazaVea,Pack L'OREÁL Crema Facial con Ácido Hialurónico Día Frasco 50ml + Revitalift Contorno Ojos Tubo 15ml + Serum Revitalift Frasco 30ml,184.90,
PlazaVea,Pack Bebida Energizante MONSTER Energy Mango Loco Lata 473ml Paquete 4un,25,
PlazaVea,Pack Bebida Rehidratante POWERADE Ion 4 Mora Botella 473ml Paquete 6un x 2un,16.50,
PlazaVea,Pack Agua SAN LUIS sin Gas Caja 20L + Bebida Rehidratante POWERADE Ion 4 Multisabor Botella 473ml Paquete 6un,28.90,
PlazaVea,Pack Shampoo ELVIVE Caído Resist Frasco 370ml + Acondicionador ELVIVE Caída Resist Frasco 370ml,25.90,
PlazaVea,Pack Bebida Natural BIO Manzana Aguaje y Cocona Botella 300ml Paquete 2un,5.90,
PlazaVea,Pack Bebida Natural BIO Arándano con Uva y Manzana Botella 300ml Paquete 2un,5.90,
PlazaVea,Pack Bebida BIO Manzana y Camu Camu Botella 300ml Paquete 2un,5.90,
PlazaVea,Pack Bebida Energizante MONSTER Zero Sugar Lata 473ml Paquete 4un,25,
PlazaVea,Pack CAT CHOW Gatitos Sabor Pollo Pouche 95g x3un,11.40,
PlazaVea,Pack MONSTER Bebida Energizante Ultra Lata 473ml x 4un,25,
PlazaVea,Pack DOG CHOW Adultos Cena de Carne Pouch 100g x3un,9.90,
PlazaVea,Pack Comida para Gatos FELIX Pescado para Gatitos Pouch 85g 3un,9.90,
PlazaVea,Pack Cepillo Dental SENSODYNE Limpieza Profunda Paquete 2un,20,
PlazaVea,Pack Cepillo de Dientes SENSODYNE Multiprotección Medium Paquete 2un,20,
PlazaVea,Pack GARNIER Crema Hidratante Express Aclara FPS30 50ml + Gel de Limpieza Express Aclara 150ml + Serum Express Aclara Frasco 30ml,93.90,
PlazaVea,Pack Shampoo ELVIVE Dream Long Liss Frasco 370ml + Acondicionador ELVIVE Dream Long Liss Frasco 370ml,25.90,
PlazaVea,Pack Bebida Energizante VOLT Ginseng Botella 300ml Paquete 6un + Refresco CIFRUT Fruit Punch Citrus Botella 400ml,10,
PlazaVea,Pack Bebida energizante RED BULL Light Lata 250ml Paquete 2un,12.90,
PlazaVea,Pack ELVIVE Dream Long Shampoo Frasco 370ml + Acondicionador Frasco 370ml,25.90,
PlazaVea,Pack ELVIVE Dream Long Shampoo Frasco 370ml + Acondicionador Frasco 370ml + Crema de Peinar Frasco 300ml,37.89,
PlazaVea,Pack ELVIVE Shampoo Reparación Total 5 Frasco 370ml + Acondicionador Reparación Total 5 + Mascarilla Tratamiento Cabello Dañado,37.89,
PlazaVea,Pack ELVIVE Ácido Hialurónico Shampoo Frasco 370ml + Crema de Tratamiento Frasco 300ml,25.90,
PlazaVea,Pack ELVIVE Ácido Hialurónico Shampoo Frasco 370ml + Crema para Peinar Frasco 300ml,25.90,
PlazaVea,Pack CAT CHOW Adultos Pescado y Mariscos Pouch 85g x3un,11.40,
PlazaVea,Pack CAT CHOW para Esterilizados Pescado Pouch 85g x3un,11.40,
PlazaVea,Pack DOG CHOW Adultos Razas Pequeñas Buffet de Pollo 100g x3un,9.90,
PlazaVea,Pack GARNIER Agua Micelar Todo en 1 Frasco 400ml + Óleo Frasco 100ml,37.90,
PlazaVea,Pack L'OREÁL Crema Revitalift Láserx3 Frasco 50ml+ Agua Micelar Frasco 200ml,99.50,
PlazaVea,Pack FRUCTIS Hair Food Palta Shampoo Frasco 300ml + Crema de Tratamiento Frasco 350ml,30.90,
PlazaVea,Pack FRUCTIS Hair Food Aloe Shampoo Frasco 300ml + Crema de Tratamiento Frasco 350ml,30.90,
PlazaVea,Pack FRUCTIS Hair Food Coco Shampoo Frasco 300ml + Crema de Tratamiento Frasco 350ml,30.90,
PlazaVea,Pack Detergente en Polvo ACE Regular Bolsa 4Kg + 	Suavizante de Telas DOWNY Floral Botella 700ml,42.90,
PlazaVea,Pack Cabanossi BRAEDT Paquete 2un,5,
PlazaVea,Pack Antigrasa MR MÚSCULO Cocina Naranja Repuesto Doypack 500cm3 + Sacagrasa MR. MÚSCULO Verde Repuesto Doypack 500ml,11,
PlazaVea,Pack BRAEDT Jamón Pizza y Queso Edam Paquete 370g + 	Néctar FRUGOS Durazno Caja 1L,16.50,
PlazaVea,Pack Bebida Rehidratante POWERADE Ion 4 Multisabor 473ml Paquete 6un + Agua sin Gas SAN LUIS Botella 750ml Paquete 6un,14.90,
PlazaVea,Pack PURINA ONE Perros Cachorros Todos los Tamaños con Pollo y Carne Bolsa 2Kg Paquete 2un,92,
PlazaVea,Pack Bebida POWERADE Ion 4 Multisabor 473ml Paquete 6un + Agua Mineral SAN LUIS Con Gas 625ml Paquete 6un,14.90,
PlazaVea,Pack NIVEA Serum Antimanchas 30ml + Fluido Antimanchas 40ml + Crema Contorno Ojos 15ml + Crema Anti-Manchas Noche 50ml,210.90,
PlazaVea,Pack Shampoo ELVIVE Ácido Hialurónico Frasco 680ml + Acondicionador ELVIVE Ácido Hialurónico Frasco 370ml,37.90,
PlazaVea,Pack Agua Micelar L'OREAL Ácido Hialurónico Frasco 200ml + Jabón Líquido Facial L'ORÉAL Ácido Hialurónico Frasco 150ml,52.90,
PlazaVea,Pack Crema de Tratamiento L'OREAL Revitalift Frasco 30ml + Shampoo ELVIVE Ácido Hialurónico Frasco 370ml,85.45,
PlazaVea,Pack Crema de Tratamiento L'OREAL Revitalift Frasco 30ml + Acondicionador ELVIVE Ácido Hialurónico Frasco 370ml,85.45,
PlazaVea,Pack GARNIER Mascarilla Facial de Tela Express Aclara 1un + Agua Micelar Express Aclara Frasco 400ml + Serum Express Aclara Frasco 30ml,84.90,
PlazaVea,Pack Agua SAN LUIS sin Gas Caja 20L + Bebida Rehidratante POWERADE Ion 4 Frutas Botella 473ml Paquete 6un,28.90,
PlazaVea,Pack Agua SAN LUIS sin Gas Caja 20L + Bebida Rehidratante POWERADE Ion 4 Mora Botella 473ml Paquete 6un,28.90,
PlazaVea,Pack DOG CHOW Comida para Perros Adulto Pequeño Cordero Doypack 100gr 3un,9.90,
PlazaVea,Pack Bebida BIO AMAYU Acai Botella 300ml Paquete 2un,5.90,
PlazaVea,Pack Jugo BIO AMAYU Sabor Aguaymanto Botella 300ml Paquete 2un,5.90,
PlazaVea,Pack CAT CHOW Adultos Pollo Pouch 85g x3un,11.40,
PlazaVea,"Pack DOG CHOW Cachorros Razas Pequeñas Sabor Carne, Leche y Arroz Pouch 100g x3un",9.90,
PlazaVea,Pack DOG CHOW Adultos Festival de Pollo Pouch 100g x3un,9.90,
PlazaVea,Pack Comida para Gatos FELIX Pescado Pouch 85g 3un,9.90,
PlazaVea,Pack Pizza Americana Familiar LA FLORENCIA + Jugo de Fruta NATURALE Chicha Morada Botella 1L,14.90,
PlazaVea,Pack GARNIER Express Agua Micelar Frasco 400ml + Gel de Limpieza Frasco 150ml + Crema Pote 50ml,65.90,
PlazaVea,Pack L'OREÁL Crema Revitalift Frasco 300ml + Crema Ácido Hialurónico Noche Frasco 50ml,125.90,
PlazaVea,Pack Bebida Energizante VOLT Ginseng 300ml Paquete 6un + Refresco CIFRUT Citrus Punch Botella 400ml,10,
PlazaVea,Pack Bebida Energizante VOLT Ginseng 300ml Paquete 6un + Jugo CIFRUT Island Punch Botella 400ml,10,
PlazaVea,Pack PURINA ONE Perros Adultos Minis y Pequeños con Pollo y Carne Bolsa 2kg Paquete 2un,92,
PlazaVea,Pack PURINA ONE Perros Adultos Minis y Pequeños con Pollo y Cordero Bolsa 2kg Paquete 2un,92,
PlazaVea,Pack Bebida POWERADE Ion 4 Frutas 473ml Paquete 6un + Agua Mineral SAN LUIS Con Gas 625ml Paquete 6un,14.90,
PlazaVea,Pack Bebida POWERADE Ion 4 Mora 473ml Paquete 6un + Agua Mineral SAN LUIS con Gas 625ml Paquete 6un,14.90,
PlazaVea,Pack NIVEA Serum Antimanchas Cellular 30ml + Fluido Antimanchas Cellular 40ml + Crema Luminous Contorno Ojos Tubo 15ml,182.50,
PlazaVea,Pack NIVEA Serum Antimanchas Cellular 30ml + Fluido Antimanchas Cellular 40ml + Crema Luminous Anti-Manchas Noche 50ml,195.90,
PlazaVea,Pack Bebida FRUGOS Fresh Fruit Punch de Manzana Botella 3L Paquete 2un,10,
PlazaVea,Pack DOG CHOW Comida para Perros Adulto Pequeño Pollo Pavo Doypack 100g 3un,9.90,
PlazaVea,Pack Whisky VAT 69 Botella 700ml + Gaseosa EVERVESS Ginger Ale Botella 1.5L,31.90,
PlazaVea,Pack Pizza Hawaiana Familiar LA FLORENCIA + Jugo de Fruta NATURALE Chicha Morada Botella 1L,14.90,
PlazaVea,Pack Detergente en Polvo ACE Limón Bolsa 4Kg + Suavizante de Telas DOWNY Floral Botella 700ml,42.90,
PlazaVea,Pack BRAEDT Jamón Pizza y Queso Edam Paquete 370g + 	Bebida FRUGOS Manzana Caja 1L,16.50,
PlazaVea,Pack BRAEDT Jamón Pizza y Queso Edam Paquete 370g + Néctar FRUGOS Mango Caja 1L,16.50,
PlazaVea,Pack BRAEDT Jamón Pizza y Queso Edam Paquete 370g + Bebida FRUGOS Naranja Caja 1L,16.50,
PlazaVea,Pack Bebida Rehidratante POWERADE Ion 4 Mora 473ml Paquete 6un + Agua sin Gas SAN LUIS Botella 750ml Paquete 6un,14.90,
PlazaVea,Pack Bebida Rehidratante POWERADE Ion 4 Frutas 473ml Paquete 6un + Agua sin Gas SAN LUIS Botella 750ml Paquete 6un,14.90,
PlazaVea,Pack Gaseosa PEPSI Botella 1.5L + Snack Papas Fritas LAY'S Clásicas Bolsa 160g,9.80,
PlazaVea,Pack Mascarilla Facial en Tela GARNIER Calmante Sobre 2un,19.90,
PlazaVea,Pack Mascarilla en Tela GARNIER para Ojos Hidra Bomb Jugo de Naranja Bolsa 2un,19.90,
PlazaVea,Pack Mascarilla Facial en Tela GARNIER Matificante Sobre 2un,19.90,
PlazaVea,Pack Mascarilla Facial en Tela GARNIER Revitalizante Sobre 2un,19.90,
PlazaVea,Pack Mascarilla Facial de Tela GARNIER Express Aclara Paquete 2un,19.90,
PlazaVea,Pack CIFRUT Refresco Citrus Punch 3L + Chicha Morada Max Botella 350ml,7.40,
PlazaVea,Pack PURINA ONE Perros Cachorros Todos los Tamaños con Pollo y Carne 6kg + Adultos Medianos y Grandes con Pollo y Cordero Bolsa 2kg,160,
PlazaVea,Pack PURINA ONE Perros Adultos Medianos y Grandes con Pollo y Carne 2kg + Adultos Minis y Pequeños con Pollo y Cordero Bolsa 6kg,160,
PlazaVea,Pack PURINA ONE Perros Cachorros Todos los Tamaños con Pollo y Carne 6kg + Cachorros Todos los Tamaños con Pollo y Carne Bolsa 2kg,160,
PlazaVea,Pack PURINA ONE Perros Cachorros Todos los Tamaños con Pollo y Carne 2kg + Adultos Medianos y Grandes con Pollo y Carne Bolsa 6kg,160,
PlazaVea,Pack PURINA ONE Perros Cachorros Todos los Tamaños con Pollo y Carne 2kg + Adultos Minis y Pequeños con Pollo y Cordero Bolsa 6kg,160,
PlazaVea,Pack PURINA ONE Perros Adultos Minis y Pequeños con Pollo y Cordero 2kg + Adultos Medianos y Grandes con Pollo y Cordero Bolsa 6kg,160,
PlazaVea,Pack PURINA ONE Perros Adultos Minis y Pequeños con Pollo y Cordero 6kg + Adultos Medianos y Grandes con Pollo y Cordero Bolsa 2kg,160,
PlazaVea,Pack PURINA ONE Perros Adultos Medianos y Grandes con Pollo y Carne 6kg + Adultos Minis y Pequeños con Pollo y Cordero Bolsa 2kg,160,
PlazaVea,Pack PURINA ONE Perros Adultos Medianos y Grandes con Pollo y Carne 2kg + Adultos Medianos y Grandes con Pollo y Carne Bolsa 6kg,160,
PlazaVea,Pack PURINA ONE Perros Adultos Minis y Pequeños con Pollo y Cordero 6kg + Adultos Minis y Pequeños con Pollo y Cordero Bolsa 2kg,160,
PlazaVea,Pack PURINA ONE Perros Adultos Medianos y Grandes con Pollo y Carne 6kg + Adultos Medianos y Grandes con Pollo y Cordero Bolsa 2kg,160,
PlazaVea,Pack PURINA ONE Perros Cachorros Todos los Tamaños con Pollo y Carne 2kg + Adultos Medianos y Grandes con Pollo y Cordero Bolsa 6kg,160,
PlazaVea,Pack PURINA ONE Perros Adultos Medianos y Grandes con Pollo y Carne 2kg + Adultos Medianos y Grandes con Pollo y Cordero Bolsa 6kg,160,
PlazaVea,Pack PURINA ONE Perros Adultos Medianos y Grandes con Pollo y Carne Bolsa 2kg Paquete 2un,92,
PlazaVea,Pack PURINA ONE Perros Cachorros Todos los Tamaños con Pollo y Carne 6kg + Adultos Medianos y Grandes con Pollo y Carne Bolsa 2kg,160,
PlazaVea,Pack PURINA ONE Perros Adultos Medianos y Grandes con Pollo Cordero Bolsa 6kg + Bolsa 2kg,160,
PlazaVea,Pack PURINA ONE Perros Cachorros Todos los Tamaños con Pollo y Carne 6kg + Adultos Minis y Pequeños con Pollo y Cordero Bolsa 2kg,160,
PlazaVea,Pack PURINA ONE Perros Adultos Medianos y Grandes con Pollo y Cordero Bolsa 2kg Paquete 2un,92,
PlazaVea,Pack Pizza de Pepperoni Personal + Chicha Morada FRUGOS Botella 300ml,6.90,
PlazaVea,Pack Whisky OLD PARR 12 Años Botella 750ml + Hielo Cocktail BELL'S SELECCIÓN Bolsa 1.8Kg,92.90,
PlazaVea,Pack Gaseosa COCA COLA Sin Azúcar Botella 1L + Pizza Pepperoni Familiar LA FLORENCIA,14.90,
PlazaVea,Pack Gaseosa INCA KOLA Sin Azúcar Botella 1L + Pizza Pepperoni Familiar LA FLORENCIA,14.90,
PlazaVea,Pack Gaseosa INCA KOLA Botella 1L + Pizza Pepperoni Familiar LA FLORENCIA,14.90,
PlazaVea,Pack Gaseosa COCA COLA Botella 1L + Pizza Pepperoni Familiar LA FLORENCIA,14.90,
PlazaVea,Pack Jugo de Fruta NATURALE Chicha Morada Botella 1L + Pizza Pepperoni Familiar LA FLORENCIA,14.90,
PlazaVea,Pack Bebida Energizante RED BULL Tropical Lata 250ml Paquete 2un,12.90,
PlazaVea,Pack Bebida energizante RED BULL Lata 250Ml Paquete 2un,12.90,
PlazaVea,Pack Jugo de Fruta NATURALE Chicha Morada Botella 1L + Empanada de Pollo Paquete 4un,13.90,
PlazaVea,Pack Jugo de Fruta NATURALE Chicha Morada Botella 1L + Empanada de Carne Paquete 4un,13.90,
PlazaVea,Pack Pizza Americana Personal + Chicha Morada FRUGOS Botella 300ml,6.90,
PlazaVea,Pack Pizza Hawaiana Personal + Chicha Morada FRUGOS Botella 300ml,6.90,
PlazaVea,Pack Whisky JOHNNIE WALKER Black Label Botella 1L + Hielo Cocktail BELL'S SELECCIÓN Bolsa 1.8Kg,154.90,
PlazaVea,Pack Gaseosa PEPSI BLACK Botella 3L + Gaseosa SEVEN UP Lima Limón Botella 3L,9.90,
PlazaVea,Pack Chicha Morada FRUGOS Botella 1L + Empanada de Pollo Paquete 4un,13.90,
PlazaVea,Pack Chicha Morada FRUGOS Botella 1L + Empanada de Carne Paquete 4un,13.90,
PlazaVea,Pack Chicha Morada FRUGOS Botella 300ml + Empanada de Carne,3.90,
PlazaVea,Pack Chicha Morada FRUGOS Botella 300ml + Empanada de Pollo,3.90,
PlazaVea,Pack Gaseosa COCA COLA Sin Azúcar Botella 1L + Empanada de Pollo Paquete 4un,13.90,
PlazaVea,Pack Gaseosa COCA COLA Sin Azúcar Botella 1L + Empanada de Carne Paquete 4un,13.90,
PlazaVea,Pack Gaseosa INCA KOLA Sin Azúcar Botella 1L + Empanada de Pollo Paquete 4un,13.90,
PlazaVea,Pack Gaseosa INCA KOLA Sin Azúcar Botella 1L + Empanada de Carne Paquete 4un,13.90,
PlazaVea,Pack Gaseosa INCA KOLA Botella 1L + Empanada de Pollo Paquete 4un,13.90,
PlazaVea,Pack Gaseosa INCA KOLA Botella 1L + Empanada de Carne Paquete 4un,13.90,
PlazaVea,Pack Gaseosa COCA COLA Botella 1L + Empanada de Pollo Paquete 4un,13.90,
PlazaVea,Pack Gaseosa COCA COLA Botella 1L + Empanada de Carne Paquete 4un,13.90,
PlazaVea,Pack Whisky SANDY MAC Botella 750ml + Gaseosa EVERVESS Ginger Ale Botella 1.5L,44.90,
PlazaVea,Pack Whisky VAT 69 Apple Botella 700ml + Gaseosa EVERVESS Ginger Ale Botella 1.5L,37.90,
PlazaVea,Pack Whisky VAT 69 Honey Botella 700ml + Gaseosa EVERVESS Ginger Ale Botella 1.5L,37.90,
PlazaVea,Pack Whisky JOHNNIE WALKER Double Black Botella 750ml + Hamburguesa BEST MEATS Carne Angus Caja 4un,159.90,
PlazaVea,Pack Cerveza BUDWEISER Malta Lata 269ml 6 Pack x 2un,32.90,
PlazaVea,Pack Pasta Dental AQUAFRESH Little Teeth Tubo 63g + Cepillo de Dientes AQUAFRESH Little Teeth Paquete 1un,15.10,
PlazaVea,Pack Mascarilla Facial de Tela GARNIER Skin Active Pure Carbón Paquete 2un,19.90,
PlazaVea,Pack Pizza Americana Familiar LA FLORENCIA + Gaseosa INCA KOLA Botella 1L,14.90,
PlazaVea,Pack Pizza Americana Familiar LA FLORENCIA + Gaseosa INCA KOLA Sin Azúcar Botella 1L,14.90,
PlazaVea,Pack Pizza Americana Familiar LA FLORENCIA + Gaseosa COCA COLA Sin Azúcar Botella 1L,14.90,
PlazaVea,Pack Pizza Americana Familiar LA FLORENCIA + Gaseosa COCA COLA Botella 1L,14.90,
PlazaVea,Pack Pizza Hawaiana Familiar LA FLORENCIA + Gaseosa INCA KOLA Botella 1L,14.90,
PlazaVea,Pack Pizza Hawaiana Familiar LA FLORENCIA + Gaseosa INCA KOLA Sin Azúcar Botella 1L,14.90,
PlazaVea,Pack Pizza Hawaiana Familiar LA FLORENCIA + Gaseosa COCA COLA Sin Azúcar Botella 1L,14.90,
PlazaVea,Pack Pizza Hawaiana Familiar LA FLORENCIA + Gaseosa COCA COLA Botella 1L,14.90,
PlazaVea,Pack L'OREÁL Hidra Total Gel Frasco 150ml + Crema Hidratante Frasco 50ml + Agua Micelar Frasco 200ml,71,
PlazaVea,Bisteck de Res EL BUEN CORTE,39.90,Presentación 0.6 kg aprox.
PlazaVea,Filete de Tilapia BELL'S Bolsa 1Kg,23.49,Presentación 0.6 kg aprox.
PlazaVea,Medallón de Pavita SAN FERNANDO Congelado,18.90,Presentación 0.6 kg aprox.
PlazaVea,Chuleta Punta de Lomo de Cerdo EL BUEN CORTE,11.89,Presentación 0.6 kg aprox.
PlazaVea,Filete de Basa BELL'S Bolsa 1Kg,12.50,Presentación 0.6 kg aprox.
PlazaVea,Guiso de Pechuga de Pavita SAN FERNANDO Congelado,19.89,Presentación 0.6 kg aprox.
PlazaVea,Alitas de Pollo SADIA Bolsa 1Kg,12.80,Presentación 0.6 kg aprox.
PlazaVea,Corazón de Res,12.90,Presentación 0.6 kg aprox.
PlazaVea,Chuleta Parrillera de Cerdo,17.98,Presentación 0.6 kg aprox.
PlazaVea,Panceta de Cerdo con Hueso con Piel EL BUEN CORTE pro,28.90,Presentación 0.6 kg aprox.
PlazaVea,Pollo Entero Aderezo Leña REDONDOS Paquete 1Kg,17.90,Presentación 0.6 kg aprox.
PlazaVea,Bife Angosto de Res EL BUEN CORTE,48.90,Presentación 0.6 kg aprox.
PlazaVea,Pollo Trozado Macerado SAN FERNANDO Asu Olla! Sazón Pollo Al Horno Bolsa 800g,14.40,Presentación 0.6 kg aprox.
PlazaVea,Pollo Trozado Macerado SAN FERNANDO Asu Olla! Sazón Pollo Oriental Bolsa 800g,13.40,Presentación 0.6 kg aprox.
PlazaVea,Pollo Trozado Macerado SAN FERNANDO Asu Olla! Sazón Pollo Pollada Bolsa 800g,14.40,Presentación 0.6 kg aprox.
PlazaVea,Pollada Criolla REDONDOS Pierna con Encuentro Bolsa 600g,11.90,Presentación 0.6 kg aprox.
PlazaVea,Bife Angosto LAS NORAS,99.90,Presentación 0.6 kg aprox.
PlazaVea,Baby Back Ribs de Cerdo Importado,45.90,Presentación 0.6 kg aprox.
PlazaVea,Churrasco Parrillero de Res,29.89,Presentación 0.6 kg aprox.
PlazaVea,Asado de Tira con Hueso Americano BIG RANCH,119.90,Presentación 0.6 kg aprox.
PlazaVea,Pavo Entero con Menudencia SAN FERNANDO,13.90,Presentación 0.6 kg aprox.
PlazaVea,Rodaja de Pierna de Pavita SAN FERNANDO Congelado,13.90,Presentación 0.6 kg aprox.
PlazaVea,Filete de Trucha BELL'S Congelado con Piel Bolsa 500g,26.90,Presentación 0.6 kg aprox.
PlazaVea,Hígado de Res Importado,13.90,Presentación 0.6 kg aprox.
PlazaVea,Bonito Entero Congelado z,7.90,Presentación 0.6 kg aprox.
PlazaVea,Filete Pierna Pollo con Piel Empacada al vacío SAN FERNANDO,18.80,Presentación 0.6 kg aprox.
PlazaVea,Mixtura de Mariscos BELL'S Bolsa 500g,14.90,Presentación 0.6 kg aprox.
PlazaVea,Langostinos Precocidos BELL'S Bolsa 300g,21.90,Presentación 0.6 kg aprox.
PlazaVea,Filete de Tilapia Importado,24.90,Presentación 0.6 kg aprox.
PlazaVea,Filete de Basa,19.90,Presentación 0.6 kg aprox.
PlazaVea,Pavo con Menudencia REDONDOS,12.90,Presentación 0.6 kg aprox.
PlazaVea,Pollo Fresco con Menudencia,10.20,Presentación 0.6 kg aprox.
PlazaVea,Carne Molida de Res Empacada al vacío EL BUEN CORTE,23.90,Presentación 0.6 kg aprox.
PlazaVea,Filete Pechuga Corte Mariposa Empacada al vacío SAN FERNANDO,24.80,Presentación 0.6 kg aprox.
PlazaVea,Muslo de Pollo Empacada al vacío SAN FERNANDO,15.40,Presentación 0.6 kg aprox.
PlazaVea,Pechuga Entera de Pollo Empacada al vacío SAN FERNANDO,14.30,Presentación 0.6 kg aprox.
PlazaVea,Pechuga Especial de Pollo Empacada al vacío SAN FERNANDO,17.40,Presentación 0.6 kg aprox.
PlazaVea,Carne Molida Light de Res Empacada al vacío EL BUEN CORTE,33.20,Presentación 0.6 kg aprox.
PlazaVea,Piernitas de Pollo Congeladas SADIA Bolsa 1Kg,8.80,Presentación 0.6 kg aprox.
PlazaVea,Pierna con Encuentro de Pollo Empacada al vacío SAN FERNANDO,12.80,Presentación 0.6 kg aprox.
PlazaVea,Pierna de Pollo Empacada al vacío SAN FERNANDO,15.20,Presentación 0.6 kg aprox.
PlazaVea,Guiso Tierno de Res EL BUEN CORTE,25.90,Presentación 0.6 kg aprox.
PlazaVea,Milanesa de Pollo,24.90,Presentación 0.6 kg aprox.
PlazaVea,PORCINO CHULETA DE BRAZUELO CONG X KG,15.90,Presentación 0.6 kg aprox.
PlazaVea,Sangrecita de Pollo REDONDOS Bolsa 500g,7.30,Presentación 0.6 kg aprox.
PlazaVea,Filete Pierna Pollo Sin Piel Empacada al vacío SAN FERNANDO,20.80,Presentación 0.6 kg aprox.
PlazaVea,Sasami de Pollo Empacada al vacío SAN FERNANDO,24.80,Presentación 0.6 kg aprox.
PlazaVea,Hígado de pollo Empacada al vacío SAN FERNANDO,7.70,Presentación 0.6 kg aprox.
PlazaVea,Molleja de Pollo Empacada al vacío SAN FERNANDO,12.80,Presentación 0.6 kg aprox.
PlazaVea,Patas de Pollo Empacada al vacío SAN FERNANDO,6.80,Presentación 0.6 kg aprox.
PlazaVea,Ala de Pollo Empacada al vacío SAN FERNANDO,13.80,Presentación 1.2 kg aprox.
PlazaVea,Lomo Saltado de Res EL BUEN CORTE,43.39,Presentación 1.2 kg aprox.
PlazaVea,Guiso Especial de Res EL BUEN CORTE,38.90,Presentación 1.2 kg aprox.
PlazaVea,Porciones de Salmón Atlántico AQUA Bolsa 500g,39.90,Presentación 1.2 kg aprox.
PlazaVea,Mondongo de Cau Cau,10.90,Presentación 1.2 kg aprox.
PlazaVea,Panceta de Cerdo con Piel,28.99,Presentación 1.2 kg aprox.
PlazaVea,Carne Molida de Pavita x500g,12.90,Presentación 1.2 kg aprox.
PlazaVea,Osobuco de Res,23.90,Presentación 1.2 kg aprox.
PlazaVea,Churrasco Redondo de Res,32.48,Presentación 1.2 kg aprox.
PlazaVea,Chuleta de Pierna de Cerdo sin Piel,18.48,Presentación 1.2 kg aprox.
PlazaVea,Chanfainita de Res,9.90,Presentación 1.2 kg aprox.
PlazaVea,Costillar de Res,18.90,Presentación 1.2 kg aprox.
PlazaVea,Pechuga de Pavita en Trozos SAN FERNANDO Congelado,14.59,Presentación 1.2 kg aprox.
PlazaVea,Corazón de Pollo Empacada al vacío SAN FERNANDO,11.80,Presentación 1.2 kg aprox.
PlazaVea,Porciones de Trucha PISCIS Bolsa 500g,29.90,Presentación 1.2 kg aprox.
PlazaVea,El Bistecito SAN FERNANDO Bolsa 4un,7.20,Presentación 1.2 kg aprox.
PlazaVea,Langostino Cocido Pelado BELL'S 61/70 Chico Bolsa 300g,18.90,Presentación 1.2 kg aprox.
PlazaVea,Malaya de Res EL BUEN CORTE,31.49,Presentación 1.2 kg aprox.
PlazaVea,Cuadril de Cadera de Res EL BUEN CORTE,49.90,Presentación 1.2 kg aprox.
PlazaVea,Hamburguesa Casera de Res LA FLORENCIA,18.49,Presentación 1.2 kg aprox.
PlazaVea,Mondongo Italiano,10.90,Presentación 1.2 kg aprox.
PlazaVea,Chuleta de Lomo de Cerdo con Piel,20.90,Presentación 1.2 kg aprox.
PlazaVea,Guiso de Cerdo Nacional Fresco x kg,23.90,Presentación 1.2 kg aprox.
PlazaVea,Bife de Lomo de Cerdo EL BUEN CORTE,27.30,Presentación 1.2 kg aprox.
PlazaVea,Punta de Pecho de Res,20.90,Presentación 1.2 kg aprox.
PlazaVea,Trucha Eviscerada,16.90,Presentación 1.2 kg aprox.
PlazaVea,Porciones de Perico BELL'S Bolsa 500g,18.90,Presentación 1.2 kg aprox.
PlazaVea,Filete de Perico Congelado,29.90,Presentación 1.2 kg aprox.
PlazaVea,Pollo Fresco con Menudencia SAN FERNANDO,10.60,Presentación 1.2 kg aprox.
PlazaVea,Lomo Fino de Res EL BUEN CORTE,76.90,Presentación 1.2 kg aprox.
PlazaVea,Bife Ancho de Res EL BUEN CORTE,49.90,Presentación 1.2 kg aprox.
PlazaVea,Carne Molida LA COLONIA x kg,22.86,Presentación 1.2 kg aprox.
PlazaVea,Chuleta de Pavita SAN FERNANDO Congelado,21.89,Presentación 1.2 kg aprox.
PlazaVea,Pierna Especial de Pollo Empacada al vacío SAN FERNANDO,14.30,Presentación 1.2 kg aprox.
PlazaVea,Espinazo de pollo Empacada al vacío SAN FERNANDO,8.10,Presentación 1.2 kg aprox.
PlazaVea,Filete de Pejerrey AZUL MARINO Corte Mariposa Bolsa 200g,7.90,Presentación 1.2 kg aprox.
PlazaVea,Medallones de Tollo Azul UMI FOODS Bolsa 500g,13.99,Presentación 1.2 kg aprox.
PlazaVea,Trucha Deshuesada PISCIS Bolsa 700g,29.90,Presentación 1.2 kg aprox.
PlazaVea,Asado de Pejerrey MAFROX,35.28,Presentación 1.2 kg aprox.
PlazaVea,Mejillones ALIPOFRESCO Paquete 300g,9.90,Presentación 1.2 kg aprox.
PlazaVea,Filete de Pechuga AVINKA A la Pimienta Bolsa 4un,18.90,Presentación 1.2 kg aprox.
PlazaVea,Langostino Cocido Pelado BELL'S 21/30 Grande Bolsa 300g,22.90,Presentación 1.2 kg aprox.
PlazaVea,Mixtura de Mariscos GOVIMAR Bolsa 500g,15.90,Presentación 1.2 kg aprox.
PlazaVea,Trucha Eviscerada BELL'S Bolsa 1kg,26.90,Presentación 1.2 kg aprox.
PlazaVea,Porciones de Pez Espada BELL'S Bolsa 400g,20.50,Presentación 1.2 kg aprox.
PlazaVea,Pejerrey Congelado,20.90,Presentación 1.2 kg aprox.
PlazaVea,Panceta de Cerdo con Hueso sin Piel EL BUEN CORTE,28.90,Presentación 1.2 kg aprox.
PlazaVea,Filete de Pechuga de Pollo Criollo REDONDOS Bolsa 620g,17.50,Presentación 1.2 kg aprox.
PlazaVea,Bondiola de Cerdo EL BUEN CORTE,32.90,Presentación 1.2 kg aprox.
PlazaVea,Albóndiga de Res EL BUEN CORTE,24.49,Presentación 1.2 kg aprox.
PlazaVea,Albóndigas de Carne de Res RANCHERAS Bolsa 600g,24.90,Bolsa 600g
PlazaVea,Asado de Tira de Res,38.49,Bolsa 600g
PlazaVea,Enrollado de Bondiola de Cerdo SAN FERNANDO,21.90,Bolsa 600g
PlazaVea,Bife Lomo de Cerdo SAN FERNANDO,30.90,Bolsa 600g
PlazaVea,Churrasco Largo de Res,34.98,Bolsa 600g
PlazaVea,Chuleta de Lomo de Cerdo,22.50,Bolsa 600g
PlazaVea,Asado Pejerrey de Res EL BUEN CORTE,41.90,Bolsa 600g
PlazaVea,Baby Chicken Congelado REDONDOS,14.90,Bolsa 600g
PlazaVea,Colita de Cuadril de Res EL BUEN CORTE,52.90,Bolsa 600g
PlazaVea,Nuggets de Tilapia SANTA PRISCILA Bolsa 454g,16.99,Bolsa 600g
PlazaVea,Peskitos de Merluza PESCANOVA Bolsa 300g,12.90,Bolsa 600g
PlazaVea,Palitos de Merluza PESCANOVA Bolsa 300g,8.50,Bolsa 600g
PlazaVea,Huevera Congelada DEXIM Bolsa 500g,19.90,Bolsa 600g
PlazaVea,Porciones de Corvina SEAFROST,79.90,Bolsa 600g
PlazaVea,Filete de Pechuga de Pollo ARTISAN Libre de Antibióticos x kg,35.90,Bolsa 600g
PlazaVea,Carne Molida de Pollo AVINKA,23.40,Bolsa 600g
PlazaVea,Anillas de Calamar Rebozadas PESCANOVA Bolsa 500g,13.90,Bolsa 600g
PlazaVea,Bife Parrillero Americano BIG RANCH,65.90,Bolsa 600g
PlazaVea,Bisteck MAFROX x kg,32.28,Bolsa 600g
PlazaVea,Piernas y Muslos Aderezo Pachamanca REDONDOS Bolsa 650g,13.49,Bolsa 600g
PlazaVea,Pollada Criolla REDONDOS Media Pechuga y Pierna con Encuentro Bolsa 800g,14.49,Bolsa 600g
PlazaVea,Colita de Cuadril URUBEEF,76.90,Bolsa 600g
PlazaVea,Asado de Cerdo EL BUEN CORTE,26.50,Bolsa 600g
PlazaVea,Filete de Pechuga de Pollo Oriental REDONDOS Bandeja 620g,17.50,Bolsa 600g
PlazaVea,Panceta de Cerdo sin Hueso sin Piel El EL BUEN CORTE,39.90,Bolsa 600g
PlazaVea,Bondiola de Cerdo,30.90,Bolsa 600g
PlazaVea,Alitas Sazonadas REDONDOS Buffalo Wings Caja 400g,14.89,Bolsa 600g
